"LANGUAGE","ORIGINAL","ENGLISH","CZECH","GERMAN","RUSSIAN","POLISH","HUNGARIAN","ITALIAN","SPANISH","FRENCH","CHINESE","PORTUGUESE","JAPANESE","CHINESESIMP",
"STR_EXPANSION_PARTY_SYSTEM_NAME_ALREADY_USED","The name of your party is already used!","The name of your party is already used!","Název skupiny je již používaný někým jiným.","Dieser Gruppenname ist bereits vergeben!","Это название группы уже используется!","Ta nazwa jest już w użyciu!","A Csapatnév már foglalt!","Il nome del tuo party è gia in uso!","¡El grupo ha sido creado!","Le nom de ton groupe est déjà utilisé !","The name of your party is already used!","O nome do seu grupo já está em uso!","そのパーティ名は既に使用されています!","你的团队名已经被其他队所使用！",
"STR_EXPANSION_PARTY_SYSTEM_PARTY_CREATED","Your party has been successfully created!","Your party has been successfully created!","Skupina úspěšně vytvořena.","Deine Gruppe wurde erfolgreich erstellt!","Группа была успешно создана!","Twoja grupa została utworzona pomyślnie!","A Csapatod elkészült!","Il tuo gruppo è stato creato con successo!","¡El nombre del grupo ya está siendo usado!","Ton groupe a été créé avec succès !","Your party has been successfully created!","O seu grupo foi criado com sucesso!","パーティーは正常に作成されました!","团队创建成功！",
"STR_EXPANSION_PARTY_SYSTEM_PARTY_DISSOLVED","Your party has been dissolved!","Your party has been dissolved!","Skupina úspěšně rozpuštěna.","Deine Gruppe wurde aufgelöst!","Группа была успешно распущена!","Twoja grupa została rozwiązana!","A Csapatod feloszlott!","Il tuo gruppo è stato sciolto!","¡El grupo ha sido disuelto!","Ton groupe a été dissous !","Your party has been dissolved!","O seu grupo foi desfeito!","パーティーは解散されました!","你的团队已被解除！",
"STR_EXPANSION_PARTY_SYSTEM_PLAYER_ALREADY_IN_PARTY","That player is already in a party!","That player is already in a party!","Hráč už v nějaké skupině je!","Dieser Spieler ist bereits in der Gruppe!","Этот игрок уже в группе!","Ten gracz jest członkiem innej drużyny!","Ez a játékos már Csapatban van!","Quel player è già in un gruppo!","¡Ese jugador ya esta en un grupo!","Ce joueur est déja dans un groupe !","That player is already in a party!","O jogador já está no seu grupo!","そのプレーヤーは既にパーティーに属しています!","该玩家已在团队中！",
"STR_EXPANSION_PARTYHUD_TITLE","Party Hud","Party Hud","Party Hud","Party Hud","Груповой HUD","Party Hud","Party Hud","Party Hud","Party Hud","Party Hud","Party Hud","Party Hud","Party Hud","Party Hud",
"STR_EXPANSION_PARTYHUD_TOGGLE","Switched Visibility of the Party Hud","Switched Visibility of the Party Hud","Přepnout viditelnost Party Hud","Switched Visibility of the Party Hud","Переключенная видимость групового HUD","Switched Visibility of the Party Hud","Switched Visibility of the Party Hud","Switched Visibility of the Party Hud","Switched Visibility of the Party Hud","Switched Visibility of the Party Hud","Switched Visibility of the Party Hud","Switched Visibility of the Party Hud","Switched Visibility of the Party Hud","Switched Visibility of the Party Hud",
"STR_EXPANSION_TOGGLE_PARTYHUD","Toggle PartyHud","Toggle PartyHud","Přepnout PartyHud","Toggle PartyHud","Включить груповой HUD","Toggle PartyHud","Toggle PartyHud","Toggle PartyHud","Toggle PartyHud","Toggle PartyHud","Toggle PartyHud","Toggle PartyHud","Toggle PartyHud","Toggle PartyHud",
