LANGUAGE,ORIGINAL,ENGLISH,CZECH,GERMAN,RUSSIAN,POLISH,HUNGARIAN,ITALIAN,SPANISH,FRENCH,CHINESE,PORTUGUESE,JAPANESE,CHINESE SIMP.
STR_MOD_EXPANSION_NAME,DayZ Expansion,DayZ Expansion,DayZ Expansion,DayZ Expansion,DayZ Expansion,DayZ Expansion,DayZ Expansion,DayZ Expansion,DayZ Expansion,DayZ Expansion,DayZ Expansion（DAYZ擴展模組）,DayZ Expansion,DayZ Expansion,DayZ Expansion（DAYZ扩展模组）
STR_MOD_EXPANSION_DESC,The DayZ Expansion Mod extends the game with a variety of new content and game systems created on the basis of wishes from the DayZ community.,The DayZ Expansion Mod extends the game with a variety of new content and game systems created on the basis of wishes from the DayZ community.,"The DayZ Expansion mód rozšiřuje hru s novým obsahem a herními systémy, vytvořených na základě přání komunity DayZ.",The DayZ Expansion Mod extends the game with a variety of new content and game systems created on the basis of wishes from the DayZ community.,"DayZ Expansion - дополняет игру разнообразным новым контентом и игровыми системами, созданными на основе пожеланий сообщества DayZ.",DayZ Expansion Mod rozszerza grę o szereg nowych treści i systemów gier stworzonych na podstawie życzeń społeczności DayZ.,The DayZ Expansion Mod extends the game with a variety of new content and game systems created on the basis of wishes from the DayZ community.,DayZ Expansion Mod amplia il gioco grazie ad una nuova varietà di contenuti e meccaniche di gioco create in base alle richiesta della community di Dayz.,El Mod DayZ Expansion extiende el juego con una variedad de contenido y sistemas creados en base a deseos de la comunidad.,The DayZ Expansion Mod extends the game with a variety of new content and game systems created on the basis of wishes from the DayZ community.,DayZ Expansion 擴展模組擴展了遊戲的玩法和內容，根據社區的成員們創建了各種新的交互系統和全新的遊戲內容。,O DayZ Expansion Mod estende o jogo com uma variedade de novos conteúdos e sistemas de jogos criados com base nos desejos da comunidade DayZ.,The DayZ Expansion Mod extends the game with a variety of new content and game systems created on the basis of wishes from the DayZ community.,DayZ Expansion 扩展模组扩展了游戏的玩法和内容，根据社区的成员们创建了各种新的交互系统和全新的游戏内容。
STR_MOD_EXPANSION_AUTHOR,DayZ Expansion Mod Team,DayZ Expansion Mod Team,Tým DayZ Expansion módu,DayZ Expansion Mod Team,Команда DayZ Expansion,Drużyna DayZ Expansion Mod,DayZ Expansion Mod Team,DayZ Expansion Mod Team,DayZ Expansion Mod Team,L'équipe DayZ Expansion Mod,DayZ Expansion 擴展模組團隊,"Equipe DayZ Expansion Mod 
",DayZ Expansion Mod Team,DayZ Expansion 扩展模组团队
STR_EXPANSION_PAINT,Paint,Paint,Malovat,Farbe,Покрасить,Farba,Paint,Dipingi,Pintura,Peindre,噴漆,Pintura,Paint,喷漆
STR_EXPANSION_SAFEZONE_TITLE,Safezone,Safezone,Bezpečná zóna,Safezone,Безопасная зона,Bezpieczna Strefa,Biztonságos Zóna,Area Sicura,Zona Segura,Safezone,安全區,Área Segura,セーフゾーン,安全区
STR_EXPANSION_SAFEZONE_ENTER,You have entered a safezone!,You have entered a safezone!,Vstoupil/a jsi do bezpečné zóny!,Du hast die Safezone betreten!,Вы вошли в безопасную зону!,Wszedłeś do Bezpiecznej Strefy!,Beléptél a biztonságos zónába!,Sei entrato in un area sicura,Has entrado una zona segura,Tu es entré dans une safezone !,你已經進入安全區！,Você entrou na Área Segura!,セーフゾーンへ入りました,你已经进入安全区！
STR_EXPANSION_SAFEZONE_LEFT,You have left a safezone!,You have left a safezone!,Opustil/a jsi bezpečnou zónu!,DU hast die Safezone verlassen!,Вы покинули безопасную зону!,Opuściłeś Bezpieczną Strefę!,Elhagytad a biztonságos zónát!,Sei uscito da un area sicura,Has abandonado la zona segura,Tu es sorti d'une safezone !,你已經離開安全區！,Você saiu da Área Segura!,セーフゾーンから出ました,你已经离开安全区！
STR_EXPANSION_SAFEZONE_LEAVING,You are leaving a safezone!,You are leaving a safezone!,You are leaving a safezone!,You are leaving a safezone!,Вы покидаете безопасную зону!,You are leaving a safezone!,You are leaving a safezone!,Stai uscendo da una Safezone!,¡Estas saliendo de la zona segura!,Tu es en train de sortir d'un safezone !,您要離開安全區！,You are leaving a safezone!,You are leaving a safezone!,您要离开安全区！
STR_EXPANSION_TEMPORARY_STORAGE,Temporary Storage Container,Temporary Storage Container,Temporary Storage Container,Temporärer Behälter,Контейнер для временного хранения,Temporary Storage Container,Temporary Storage Container,Temporary Storage Container,Contenedor temporal de almacenaje,Conteneur de stockage temporaire,Temporary Storage Container,Temporary Storage Container,Temporary Storage Container,临时储存容器
STR_EXPANSION_TEMPORARY_STORAGE_DESC,A temporary storage container for items that didn't fit into the inventory. Only accessible by the owner. Will be automatically deleted after 20 minutes or when emptied out.,A temporary storage container for items that didn't fit into the inventory. Only accessible by the owner. Will be automatically deleted after 20 minutes or when emptied out.,A temporary storage container for items that didn't fit into the inventory. Only accessible by the owner. Will be automatically deleted after 20 minutes or when emptied out.,"Ein temporärer Behälter für Gegenstände, die nicht mehr ins Inventar passten. Nur der Besitzer hat auf den Inhalt Zugriff. Wird nach 20 Minuten, oder wenn er geleert wurde, automatisch entfernt.","Контейнер для временного хранения предметов, купленных у торговца. Доступен только вам. Будет автоматически удален через 20 минут или когда будет опустошен.",A temporary storage container for items that didn't fit into the inventory. Only accessible by the owner. Will be automatically deleted after 20 minutes or when emptied out.,A temporary storage container for items that didn't fit into the inventory. Only accessible by the owner. Will be automatically deleted after 20 minutes or when emptied out.,A temporary storage container for items that didn't fit into the inventory. Only accessible by the owner. Will be automatically deleted after 20 minutes or when emptied out.,Un contenedor de almacenamiento temporal para artículos comprados en un comerciante. Solo accesible por ti. Se eliminará automáticamente después de 20 minutos o cuando se vacíe.,Un conteneur de stockage temporaire pour les articles achetés chez un commerçant. Uniquement accessible par vous. Sera automatiquement supprimé après 20 minutes ou lorsqu'il sera vidé.,A temporary storage container for items that didn't fit into the inventory. Only accessible by the owner. Will be automatically deleted after 20 minutes or when emptied out.,A temporary storage container for items that didn't fit into the inventory. Only accessible by the owner. Will be automatically deleted after 20 minutes or when emptied out.,A temporary storage container for items that didn't fit into the inventory. Only accessible by the owner. Will be automatically deleted after 20 minutes or when emptied out.,用于存放不适合库存的物品的临时存储容器。 只能由所有者访问。 将在 20 分钟后或清空后自动删除。
STR_EXPANSION_TEMPORARY_STORAGE_INFO,"Some items didn't fit in your inventory and were placed in a temporary, secure container on the ground. Please retrieve them soon, the container will be automatically deleted in 20 minutes.","Some items didn't fit in your inventory and were placed in a temporary, secure container on the ground. Please retrieve them soon, the container will be automatically deleted in 20 minutes.","Some items didn't fit in your inventory and were placed in a temporary, secure container on the ground. Please retrieve them soon, the container will be automatically deleted in 20 minutes.","Einige Gegenstände passten nicht mehr in dein Inventar und wurden in einem sicheren Behälter mit begrenzter Lebensdauer auf dem Boden platziert. Bitte hole sie rechtzeitig heraus, der Behälter wird in 20 Minuten automatisch entfernt.","Некоторые предметы не поместились в ваш инвентарь и были помещены во временный защищенный контейнер на земле. Пожалуйста, заберите их в ближайшее время, контейнер будет автоматически удален через 20 минут.","Some items didn't fit in your inventory and were placed in a temporary, secure container on the ground. Please retrieve them soon, the container will be automatically deleted in 20 minutes.","Some items didn't fit in your inventory and were placed in a temporary, secure container on the ground. Please retrieve them soon, the container will be automatically deleted in 20 minutes.","Some items didn't fit in your inventory and were placed in a temporary, secure container on the ground. Please retrieve them soon, the container will be automatically deleted in 20 minutes.","Algunos artículos no cabían en su inventario y se colocaron en un contenedor temporal y seguro en el suelo. Recupérelos pronto, el contenedor se eliminará automáticamente en 20 minutos.","Certains objets ne rentraient pas dans votre inventaire et ont été placés dans un conteneur temporaire et sécurisé au sol. Veuillez les récupérer rapidement, le conteneur sera automatiquement supprimé dans 20 minutes.","Some items didn't fit in your inventory and were placed in a temporary, secure container on the ground. Please retrieve them soon, the container will be automatically deleted in 20 minutes.","Some items didn't fit in your inventory and were placed in a temporary, secure container on the ground. Please retrieve them soon, the container will be automatically deleted in 20 minutes.","Some items didn't fit in your inventory and were placed in a temporary, secure container on the ground. Please retrieve them soon, the container will be automatically deleted in 20 minutes.",有些物品不适合您的库存，而是放置在地面上的临时安全容器中。 请尽快取回，容器将在 20 分钟后自动删除。
STR_EXPANSION_TEMPORARY_STORAGE_EXPIRATION_WARNING,A temporary container with items that didn't fit into your inventory will be deleted soon.,A temporary container with items that didn't fit into your inventory will be deleted soon.,A temporary container with items that didn't fit into your inventory will be deleted soon.,"Ein temporärer Behälter mit Gegenständen, die nicht mehr in dein Inventar passten, wird demnächst entfernt.","Временный контейнер с предметами, которые вы купили у торговца, скоро будет удален.",A temporary container with items that didn't fit into your inventory will be deleted soon.,A temporary container with items that didn't fit into your inventory will be deleted soon.,A temporary container with items that didn't fit into your inventory will be deleted soon.,Pronto se eliminará un contenedor temporal con artículos que compró a un comerciante.,Un conteneur temporaire contenant des objets que vous avez achetés auprès d'un commerçant sera bientôt supprimé.,A temporary container with items that didn't fit into your inventory will be deleted soon.,A temporary container with items that didn't fit into your inventory will be deleted soon.,A temporary container with items that didn't fit into your inventory will be deleted soon.,装有不适合您库存的物品的临时容器将很快被删除。
STR_EXPANSION_TEMPORARY_STORAGE_EXPIRED,A temporary container with items that didn't fit into your inventory has expired and was automatically deleted.,A temporary container with items that didn't fit into your inventory has expired and was automatically deleted.,A temporary container with items that didn't fit into your inventory has expired and was automatically deleted.,"Ein temporärer Behälter mit Gegenständen, die nicht mehr in dein Inventar passten, ist abgelaufen und wurde entfernt.","Временный контейнер с предметами, которые вы купили у торговца, истек и был автоматически удален.",A temporary container with items that didn't fit into your inventory has expired and was automatically deleted.,A temporary container with items that didn't fit into your inventory has expired and was automatically deleted.,A temporary container with items that didn't fit into your inventory has expired and was automatically deleted.,Un contenedor temporal con artículos que compró a un comerciante caducó y se eliminó automáticamente.,Un conteneur temporaire contenant des articles que vous avez achetés auprès d'un commerçant a expiré et a été automatiquement supprimé.,A temporary container with items that didn't fit into your inventory has expired and was automatically deleted.,A temporary container with items that didn't fit into your inventory has expired and was automatically deleted.,A temporary container with items that didn't fit into your inventory has expired and was automatically deleted.,装有不适合您库存的物品的临时容器已过期并被自动删除。
STR_EXPANSION_GOLD_NUGGET,Gold Nugget,Gold Nugget,Zlatá nugetka,Goldnugget,Золотой самородок,Samorodek Złota,Gold Nugget,Pepita d'Oro,Pepita de oro,Pépite d'or,金塊,Pepita de Ouro,"金のナゲット
",金块
STR_EXPANSION_GOLD_NUGGET_DESC,"A gold nugget is a naturally occurring piece of native gold. Watercourses often concentrate nuggets and finer gold in placers. Nuggets are recovered by placer mining, but they are also found in residual deposits where the gold-bearing veins or lodes are weathered. Nuggets are also found in the tailings piles of previous mining operations, especially those left by gold mining dredges.","A gold nugget is a naturally occurring piece of native gold. Watercourses often concentrate nuggets and finer gold in placers. Nuggets are recovered by placer mining, but they are also found in residual deposits where the gold-bearing veins or lodes are weathered. Nuggets are also found in the tailings piles of previous mining operations, especially those left by gold mining dredges.",Zlatý nugget je přirozeně se vyskytující kousek přírodního zlata.,"Ein Goldnugget ist ein natürliches Vorkommen von reinem Gold. Flussbette konzentrieren nuggets und feineres Gold in Lagern. Nuggets werden bei Tagebau erzeugt, aber werden auch in Restelagern gefunden. Nuggets können auch in stillgelegten Minen gefunden werden.",Природный кусок натурального золота. Можно найти в водотоках и в более мелком виде. Самородки так же могут быть обнаружены в остаточных месторождениях.,"Samorodki Złota to naturalnie występujące kawałki rodzimego złota. Cieki wodne często koncentrują samorodki złota oraz drobniejszę złoto w placerach. Samorodki są wydobyte przez kopanie placerów, ale są również znajdywane w osadach resztkowych gdzie żyły złota są zwietrzałe. Samorodki są również znalezione w stosach odpadów z porzednich akcji wydobywczych, szczególnie tych pozostawionych przez dragi wydobywające złoto.","A gold nugget is a naturally occurring piece of native gold. Watercourses often concentrate nuggets and finer gold in placers. Nuggets are recovered by placer mining, but they are also found in residual deposits where the gold-bearing veins or lodes are weathered. Nuggets are also found in the tailings piles of previous mining operations, especially those left by gold mining dredges.","Una pepita d'oro è un pezzo d'oro ritrovabile in Natura. Solitamente nei corsi d'acqua si trovano delle piccole pepite, o nei canali alluvionali. Le Pepite si trovano minando in queste aree, ma anche in depositi con vene o filoni residuali. Spesso possono trovarsi anche nelle rimanenze di precedenti escavazioni, specialmente quelle aurifere.","Una pepita de oro es una pieza de oro nativo que se produce naturalmente. Los flujos de agua suelen concentrar pepitas y oros finos en placeres. Las pepitas se recuperan mediante la minería de placeres, pero también se encuentran en depósitos residuales donde las vetas con oro están desgastadas. Las pepitas también son halladas en las pilas de relaves de operaciones mineras anteriores, especialmente las abandonadas por dragas mineras de oro","Une pépite d’or est un morceau d’or qui se trouve à l’état natif dans la nature, ou bien transformé par le courant des cours d'eau.",金塊是一塊天然的天然黃金。通常在水道或者河床上會含有許多細金。一般情況下金通過挖沙來蒐集，但含金礦脈或礦脈風化的殘餘礦床中也有大量自然金。在老的採礦作業的尾礦堆中也能夠發現金塊。,"Uma pepita de ouro é uma peça natural de ouro nativo. Os cursos de água geralmente concentram pepitas e ouro mais fino nos placers. As pepitas são recuperadas pela mineração de placers, mas também são encontradas em depósitos residuais, onde as veias ou os filões de ouro são resistidos. As pepitas também são encontradas nas pilhas de rejeitos de operações de mineração anteriores, especialmente aquelas deixadas pelas dragas de mineração de ouro","金のナゲットは天然の状態の金の粒です。水脈辺りはより大きな粒を笊などを使用して発見できる場合があります。ナゲットは蓄積させる道具を使用して集めることもできますが、鉱脈や古い鉱山などでも発見できます。
",金块是一块天然的天然黄金。通常在水道或者河床上会含有许多细金。一般情况下金通过挖沙来搜集，但含金矿脉或矿脉风化的残余矿床中也有大量自然金。在老的采矿作业的尾矿堆中也能够发现金块。
STR_EXPANSION_SILVER_NUGGET,Silver Nugget,Silver Nugget,Stříbrná nugetka,Silbernugget,Серебрянный самородок,Samorodek Srebra,Silver Nugget,Pepita d'Argento,Pepita de plata,Pépite d'argent,銀塊,Pepita de Prata,銀のナゲット,银块
STR_EXPANSION_SILVER_NUGGET_DESC,"A silver nugget is a naturally occurring piece of native silver. Watercourses often concentrate nuggets and finer silver in placers. Nuggets are recovered by placer mining, but they are also found in residual deposits where the silver-bearing veins or lodes are weathered. Nuggets are also found in the tailings piles of previous mining operations, especially those left by silver mining dredges.","A silver nugget is a naturally occurring piece of native silver. Watercourses often concentrate nuggets and finer silver in placers. Nuggets are recovered by placer mining, but they are also found in residual deposits where the silver-bearing veins or lodes are weathered. Nuggets are also found in the tailings piles of previous mining operations, especially those left by silver mining dredges.",Stříbrný nugget je přirozeně se vyskytující kousek nativního stříbra.,"Ein Silbernugget ist ein natürliches Vorkommen von reinem Silber. Flussbette konzentrieren nuggets und feineres Seilber in Lagern. Nuggets werden bei Tagebau erzeugt, aber werden auch in Restelagern gefunden. Nuggets können auch in stillgelegten Minen gefunden werden.",Природный кусок натурального серебра. Можно найти в водотоках и в более мелком виде. Самородки так же могут быть обнаружены в остаточных месторождениях.,"Samorodki Srebra to naturalnie występujące kawałki rodzimego srebra. Cieki wodne często koncentrują samorodki srebra oraz drobniejszę srebro w placerach. Samorodki są wydobyte przez kopanie placerów, ale są również znajdywane w osadach resztkowych gdzie żyły srebra są zwietrzałe. Samorodki są również znalezione w stosach odpadów z porzednich akcji wydobywczych, szczególnie tych pozostawionych przez dragi wydobywające srebro.","A silver nugget is a naturally occurring piece of native silver. Watercourses often concentrate nuggets and finer silver in placers. Nuggets are recovered by placer mining, but they are also found in residual deposits where the silver-bearing veins or lodes are weathered. Nuggets are also found in the tailings piles of previous mining operations, especially those left by silver mining dredges.","Una pepita d' argento è un pezzo d'argento ritrovabile in Natura. Solitamente nei corsi d'acqua si trovano delle piccole pepite, o nei canali alluvionali. Le Pepite si trovano minando in queste aree, ma anche in depositi con vene o filoni residuali. Spesso possono trovarsi anche nelle rimanenze di precedenti escavazioni, specialmente dove si estraeva argento appunto.","Una pepita de plata es una pieza de plata nativa que se produce naturalmente. Los flujos de agua suelen concentrar pepitas y platas finos en placeres. Las pepitas se recuperan mediante la minería de placeres, pero también se encuentran en depósitos residuales donde las vetas con plata están desgastadas. Las pepitas también son halladas en las pilas de relaves de operaciones mineras anteriores, especialmente las abandonadas por dragas mineras de plata.","Une pépite d’argent est un morceau d’or qui se trouve à l’état natif dans la nature, ou bien transformé par le courant des cours d'eau.","A silver nugget is a naturally occurring piece of native silver. Watercourses often concentrate nuggets and finer silver in placers. Nuggets are recovered by placer mining, but they are also found in residual deposits where the silver-bearing veins or lodes are weathered. Nuggets are also found in the tailings piles of previous mining operations, especially those left by silver mining dredges.","Uma pepita de prata é uma peça natural de prata nativa. Os cursos de água geralmente concentram pepitas e prata mais fina nos placers. As pepitas são recuperadas pela mineração de placers, mas também são encontradas em depósitos residuais, onde as veias ou filas de prata são resistidas. As pepitas também são encontradas nas pilhas de rejeitos de operações de mineração anteriores, especialmente aquelas deixadas pelas dragas de mineração de prata.",銀のナゲットは天然の状態の金の粒です。水脈辺りはより大きな粒を笊などを使用して発見できる場合があります。ナゲットは蓄積させる道具を使用して集めることもできますが、鉱脈や古い鉱山などでも発見できます。,
STR_EXPANSION_SILVER_BAR,Silver Bar,Silver Bar,Stříbrný prut,Silberbarren,Серебрянный слиток,Sztabka Srebra,Silver Bar,Lingotto di Argento,Lingote de plata,Lingot d'argent,銀條,Barra de Prata,銀の延棒,银条
