LANGUAGE,ORIGINAL,ENGLISH,CZECH,GERMAN,RUSSIAN,POLISH,HUNGARIAN,ITALIAN,SPANISH,FRENCH,CHINESE,PORTUGUESE,JAPANESE,CHINESE SIMP.
STR_EXPANSION_SILVER_BAR_DESC,"A silver bar, also called silver bullion or a silver ingot, is a quantity of refined metallic silver of any shape that is made by a bar producer meeting standard conditions of manufacture, labeling, and record keeping. Larger silver bars that are produced by pouring the molten metal into molds are called ingots.","A silver bar, also called silver bullion or a silver ingot, is a quantity of refined metallic silver of any shape that is made by a bar producer meeting standard conditions of manufacture, labeling, and record keeping. Larger silver bars that are produced by pouring the molten metal into molds are called ingots.","Stříbrný prut, také nazývaný stříbrný prut nebo stříbrný ingot, je množství rafinovaného kovového stříbra jakéhokoli tvaru, které vyrábí výrobce prutů splňující standardní podmínky výroby, označování a vedení záznamů. Větší stříbrné tyče, které se vyrábějí nalitím roztaveného kovu do forem, se nazývají ingoty.","Ein Silberbarren ist eine Anhäufung von raffiniertem Silber, welche in einen Barren geschmolzen wurden.",Представляет собой некое количество чистого серебра определённой формы с маркировкой. Производится путём заливки расплавленного металла.,"Sztabka Srebra to ilość rafinowanego metalicznego srebra o dowolnym kształcie, wytwarzana przez producenta sztabki spełniającego standardowe warunki produkcji, etykietowania i prowadzenia dokumentacji. Większe sztabki srebra wytwarzane przez wlewanie stopionego metalu do form nazywane są wlewkami.","A silver bar, also called silver bullion or a silver ingot, is a quantity of refined metallic silver of any shape that is made by a bar producer meeting standard conditions of manufacture, labeling, and record keeping. Larger silver bars that are produced by pouring the molten metal into molds are called ingots.","Un lingotto d' argento, è una quantità definita di argento metallico raffinato di qualsiasi forma, fabbricato rispettando degli standard di condizione di manifattura, timbratura e registrazione","Una barra de plata es una cantidad de plata metálica de cualquier forma refinado en una barra por un productor que cumple con condiciones estándar de manufactura, etiquetado y mantenimiento de registros. Las barras de plata más grandes que se producen vertiendo el metal fundido en moldes se llaman lingotes.","Un lingot d’argent est un bloc d’argent métallique raffiné de n’importe quelle forme (pièce de monnaie, barre) produit par un fabricant respectant des normes de fabrication, d’étiquetage et de suivi administratif. Les lingots les plus gros sont obtenus en faisant couler de l’argent fondu dans un moule. Les plus petits sont souvent obtenus par estampage ou matriçage à partir de feuilles d’argent roulées.",銀塊是天然的銀塊。 GMJ中有大量的銀。玩家通過砂礦開採可回收塊金，但也可在含銀礦脈或礦脈風化的殘餘礦床中發現。在以往採礦作業的尾礦堆中也發現了金塊，特別是那些由採銀挖泥船留下的。,"Uma barra de prata, também denominada lingote de prata ou lingote de prata, é uma quantidade de prata metálica refinada de qualquer formato fabricada por um produtor de barra que atende às condições padrão de fabricação, rotulagem e manutenção de registros. As barras de prata maiores que são produzidas derramando o metal fundido nos moldes são chamadas de lingotes.",銀の延棒はブイヨン、インゴットなどの名前を持つ場合があり、精製された銀を規定の量で延棒の形に生成されます。解かされたものを形に流し込み生成されますが、大型のものをインゴットと呼びます。,银块是天然的银块。GMJ中有大量的银。玩家通过砂矿开采可回收块金，但也可在含银矿脉或矿脉风化的残余矿床中发现。在以往采矿作业的尾矿堆中也发现了金块，特别是那些由采银挖泥船留下的。
STR_EXPANSION_GOLD_BAR,Gold Bar,Gold Bar,Zlatý prut,Goldbarren,Золотой слиток,Sztabka Złota,Gold Bar,Lingotto d' Oro,Lingote de oro,Lingot d'or,金條,Barra de Ouro,金の延棒,金条
STR_EXPANSION_GOLD_BAR_DESC,"A gold bar, also called gold bullion or a gold ingot, is a quantity of refined metallic gold of any shape that is made by a bar producer meeting standard conditions of manufacture, labeling, and record keeping. Larger gold bars that are produced by pouring the molten metal into molds are called ingots.","A gold bar, also called gold bullion or a gold ingot, is a quantity of refined metallic gold of any shape that is made by a bar producer meeting standard conditions of manufacture, labeling, and record keeping. Larger gold bars that are produced by pouring the molten metal into molds are called ingots.","Zlatý prut, také nazývaný zlatý prut nebo zlatý ingot, je množství rafinovaného kovového zlata jakéhokoli tvaru, které vyrábí výrobce prutů splňující standardní podmínky výroby, označování a vedení záznamů. Větší zlaté pruty, které se vyrábějí nalitím roztaveného kovu do forem, se nazývají ingoty.","Ein Goldbarren ist eine Anhäufung von raffiniertem Silber, welche in einen Barren geschmolzen wurden.",Представляет собой некое количество чистого золота определённой формы с маркировкой. Производится путём заливки расплавленного металла.,"Sztabka Złota to ilość rafinowanego metalicznego złota o dowolnym kształcie, wytwarzana przez producenta sztabki spełniającego standardowe warunki produkcji, etykietowania i prowadzenia dokumentacji. Większe sztabki złota wytwarzane przez wlewanie stopionego metalu do form nazywane są wlewkami.","A gold bar, also called gold bullion or a gold ingot, is a quantity of refined metallic gold of any shape that is made by a bar producer meeting standard conditions of manufacture, labeling, and record keeping. Larger gold bars that are produced by pouring the molten metal into molds are called ingots.","Un lingotto d' oro, è una quantità definita di oro metallico raffinato di qualsiasi forma, fabbricato rispettando degli standard di condizione di manifattura, timbratura e registrazione","Una barra de oro es una cantidad de oro metálico de cualquier forma refinado en una barra por un productor que cumple con condiciones estándar de manufactura, etiquetado y mantenimiento de registros. Las barras de oro más grandes que se producen vertiendo el metal fundido en moldes se llaman lingotes.","Un lingot d’or est un bloc d’or métallique raffiné de n’importe quelle forme (pièce de monnaie, barre) produit par un fabricant respectant des normes de fabrication, d’étiquetage et de suivi administratif. Les lingots les plus gros sont obtenus en faisant couler de l’or fondu dans un moule. Les plus petits sont souvent obtenus par estampage ou matriçage à partir de feuilles d’or roulées.",金條，又稱金條或金錠，是由一家金條生產商生產的，符合製造、標籤和記錄保存標準條件的任何形狀的精製金屬金。通過將熔化的金屬倒入鑄模而產生的較大的金條稱為錠。,"Uma barra de ouro, também chamada de barras de ouro ou lingote de ouro, é uma quantidade de ouro metálico refinado de qualquer formato fabricado por um produtor de barras que atenda às condições padrão de fabricação, rotulagem e manutenção de registros. As barras de ouro maiores que são produzidas derramando o metal fundido nos moldes são chamadas de lingotes.",金の延棒はブイヨン、インゴットなどの名前を持つ場合があり、精製された金を規定の量で延棒の形に生成されます。解かされたものを形に流し込み生成されますが、大型のものをインゴットと呼びます。,金条，又称金条或金锭，是由一家金条生产商生产的，符合制造、标签和记录保存标准条件的任何形状的精制金属金。通过将熔化的金属倒入铸模而产生的较大的金条称为锭。
STR_EXPANSION_SETTINGS_CLIENT_MAP_MARKERS_3D,3D MARKER SETTINGS,3D MARKER SETTINGS,NASTAVENÍ 3D ZNAČEK,3D MARKIERUNGSEINSTELLUNGEN,НАСТРОЙКИ 3D МЕТКИ,USTAWIENIA ZNACZNIKÓW 3D,3D MARKER SETTINGS,IMPOSTAZIONI MARCATORE 3D,AJUSTES MARCADOR 3D,OPTIONS DES MARQUEURS 3D,3D 標記設定,OPÇÕES DE MARCAÇÃO 3D,3D マーカー設定,3D 标记设定
STR_EXPANSION_SETTINGS_CLIENT_MAP_SHOW3DMARKERS,SHOW 3D MARKERS,SHOW 3D MARKERS,ZOBRAZIT 3D ZNAČKY,ZEIGE 3D MARKIERUNGEN,ПОКАЗАТЬ 3D МЕТКИ,POKAŻ ZNACZNIKI 3D,SHOW 3D MARKERS,MOSTRA MARCATORI 3D,MOSTRAR MARCADOR 3D,AFFICHER LES MARQUEURS 3D,顯示3D標記,MOSTRAR MARCAÇÃO 3D,3D マーカーの表示,显示3D标记
STR_EXPANSION_SETTINGS_CLIENT_MAP_SHOW3DMARKERS_DESC,Toggle the view of all your 3D map markers.,Toggle the view of all your 3D map markers.,Přepnout všechny 3D značky.,Schalte die Anzeige von allen 3D Karten-Markierungen um.,Вкл/Выкл отображение всех ваших 3D меток.,Włącz widok wszystkich ustawionych znaczników 3D na mapie.,Toggle the view of all your 3D map markers.,Abilita / Disabilita la visione dei marcatori 3D in mappa,Activar la vista de tus marcadores 3D,Bascule l'affichage de tous les marqueurs carte 3D.,切換你地圖上的所有自定3D視圖,Acesse a visualização de todos os seus marcadores de mapa 3D.,3D マーカー表示・非表示の切り替え,切换你地图上的所有自定3D视图
STR_EXPANSION_SETTINGS_CLIENT_MAP_SHOW3DCLIENTMARKERS,SHOW 3D PERSONAL MARKERS,SHOW 3D PERSONAL MARKERS,ZOBRAZIT OSOBNÍ 3D ZNAČKY,ZEIGE PERSONALISIERTE 3D MARKER,ПОКАЗАТЬ 3D ЛИЧНЫЕ МЕТКИ,POKAŻ MOJE ZNACZNIKI 3D,SHOW 3D PERSONAL MARKERS,MOSTRA MARCATORI PERSONALI 3D,Mostrar Marcadores 3D Personales,AFFICHER LES MARQUEURS 3D PERSONNELS,顯示個人3D標記,MOSTRAR MARCADORES PESSOAIS 3D,SHOW 3D PERSONAL MARKERS,显示个人3D标记
STR_EXPANSION_SETTINGS_CLIENT_MAP_SHOW3DCLIENTMARKERS_DESC,Toggle the view of all personal 3D map markers.,Toggle the view of all personal 3D map markers.,Přepnout všechny osobní 3D značky.,Schalte die Anzeige von allen Personalisierten 3D Karten-Markierungen um.,Переключить вид всех меток личной 3D-карты.,Włącz widok wszystkich moich ustawionych znaczników 3D na mapie.,Toggle the view of all personal 3D map markers.,Abilita / Disabilita la visione dei marcatori personali 3D in mappa,Activar la vista de tus marcadores 3D en el mapa,Bascule l'affichage des marqueurs 3D personnels.,切換地圖上所有個人3D標記,Alterne a exibição de todos os marcadores de mapa 3D pessoais.,Toggle the view of all personal 3D map markers.,切换地图上所有个人3D标记
STR_EXPANSION_SETTINGS_CLIENT_MAP_SHOW3DPLAYERMARKERS,SHOW 3D PLAYER MARKERS,SHOW 3D PLAYER MARKERS,ZOBRAZIT HRÁČSKÉ 3D ZNAČKY,ZEIGE 3D SPIELER-MARKER,ПОКАЗАТЬ 3D МЕТКИ ИГРОКА,POKAŻ ZNACZNIKI 3D GRACZA,SHOW 3D PLAYER MARKERS,MOSTRA MARCATORI 3D DEI GIOCATORI,Mostrar marcadores 3D del Jugador,AFFICHER LES MARQUEURS 3D DE JOUEURS,顯示3D玩家標記,MOSTRAR MARCADORES DE JOGADORES 3D,SHOW 3D PLAYER MARKERS,显示3D玩家标记
STR_EXPANSION_SETTINGS_CLIENT_MAP_SHOW3DPLAYERMARKERS_DESC,Toggle the view of all 3D party player markers.,Toggle the view of all 3D party player markers.,Přepnout všechny skupinové 3D značky.,Schalte die Anzeige von 3D Gruppen Spieler-Marierungen um.,Переключить вид всех 3D меток игрока ,Włącz widok wszystkich ustawionych znaczników osobowych 3D na mapie.,Toggle the view of all 3D party player markers.,Abilita / Disabilita la visione dei marcatori 3D dei giocatori nel gruppo,Activar marcadores 3D del grupo,Bascule l'affichage des marqueurs 3D des membres de groupes.,切換地圖上所有團隊玩家的3D標記,Alterne a visualização de todos os marcadores de jogadores do grupo 3D,Toggle the view of all 3D party player markers.,切换地图上所有团队玩家的3D标记
STR_EXPANSION_SETTINGS_CLIENT_MAP_SHOW3DPARTYMARKERS,SHOW 3D PARTY MARKERS,SHOW 3D PARTY MARERS,ZOBRAZIT 3D ZNAČKY SKUPINY,ZEIGE 3D GRUPPEN MARKER,ПОКАЗАТЬ 3D МЕТКИ ГРУППЫ,POKAŻ ZNACZNIKI 3D GRUPY,SHOW 3D PARTY MARERS,MOSTRA MARCATORI 3D DI GRUPPO,Mostrar marcadores 3D del grupo,AFFICHER LES MARQUEURS 3D DE GROUPE,顯示3D團隊標記,EXIBIR MARCADORES DO GRUPO 3D,SHOW 3D PARTY MARERS,显示3D团队标记
STR_EXPANSION_SETTINGS_CLIENT_MAP_SHOW3DPARTYMARKERS_DESC,Toggle the view of all 3D party map markers.,Toggle the view of all 3D party map markers.,Přepnout všechny skupinové 3D značky.,Schalte die Anzeige von allen 3D Gruppen Karten-Markierungen um.,Переключить вид всех меток карты 3D группы.,Włącz widok wszystkich ustawionych znaczników grupowych 3D na mapie.,Toggle the view of all 3D party map markers.,Abilita / Disabilita la visione dei marcatori 3D di gruppo,Activar la vista de todos los marcadores 3D globales,Bascule l'affichage des marqueurs 3D du groupe.,切換團隊成員在地圖上的3D標記,"Exibir a visualização de todos os marcadores de mapa em 3D.
",Toggle the view of all 3D party map markers.,切换团队成员在地图上的3D标记
STR_EXPANSION_SETTINGS_CLIENT_MAP_SHOW3DGLOBALMARKERS,SHOW 3D SERVER MARKERS,SHOW 3D SERVER MARKERS,ZOBRAZIT SERVEROVÉ 3D ZNAČKY,ZEIGE 3D SERVERMARKIERUNGEN,ПОКАЗАТЬ СЕРВЕРНЫЕ 3D МЕТКИ,POKAŻ ZNACZNIKI 3D SERWERA,SHOW 3D SERVER MARKERS,MOSTRA MARCATORI 3D DEL SERVER,Mostrar marcadores 3D del servidor,AFFICHER LES MARQUEURS 3D DU SERVEUR,顯示服務器上的3D標記,MOSTRAR MARCAÇÃO 3D DO SERVIDOR,クライアント 3D マーカーの表示,显示服务器上的3D标记
STR_EXPANSION_SETTINGS_CLIENT_MAP_SHOW3DGLOBALMARKERS_DESC,Toggle the view of all global 3D server markers.,Toggle the view of all global 3D server markers.,Přepnout všechny serverové 3D značky.,Schalte die Anzeige von allen globalen 3D Server Markierungen um.,Переключить вид всех глобальных 3D меток сервера.,Włącz widok wszystkich ustawionych serwerowych znaczników 3D na mapie.,Toggle the view of all global 3D server markers.,Abilita / Disabilita la visione dei marcatori 3D creati per il server,Activar la vista de todos los marcadores 3D globales,Bascule l'affichage des marqueurs 3D du serveur.,切換所有全局3D服務器標記的視圖。,"Alterne a exibição de todos os marcadores globais de servidor 3D.
",グローバル 3D マーカー表示・非表示の切り替え,切换所有全局3D服务器标记的视图。
STR_EXPANSION_SETTINGS_CLIENT_MAP_MARKERS_2D,2D MARKER SETTINGS,2D MARKER SETTINGS,NASTAVENÍ 2D ZNAČEK,2D MARKIERUNGSEINSTELLUNGEN,НАСТРОЙКИ 2D МЕТОК,USTAWIENIA ZNACZNIKÓW 2D,2D MARKER SETTINGS,IMPOSTAZIONI MARCATORI 2D,AJUSTES MARCADOR 2D,OPTIONS DES MARQUEURS 2D,2D 標記設定,OPÇÕES DE MARCAÇÃO 2D,2D マーカー設定,2D 标记设定
STR_EXPANSION_SETTINGS_CLIENT_MAP_SHOW2DMARKERS,SHOW 2D MARKERS,SHOW 2D MARKERS,ZOBRAZIT 2D ZNAČKY,ZEIGE 2D MARKIERUNGEN,ПОКАЗАТЬ 2D МЕТКИ,POKAŻ ZNACZNIKI 2D,SHOW 2D MARKERS,MOSTRA MARCATORI 2D,Mostrar marcadores 2D,AFFICHER LES MARQUEURS 2D,顯示2D標記,MOSTRAR MARCAÇÕES 2D,2D マーカー設定,显示2D标记
STR_EXPANSION_SETTINGS_CLIENT_MAP_SHOW2DMARKERS_DESC,Toggle the view of all 2D map markers.,Toggle the view of all 2D map markers.,Přepnout všechny 2D značky.,Schalte die Anzeige von allen 2D Karten-Markierungen um.,Вкл/Выкл отображение всех ваших 2D меток.,Włącz widok wszystkich ustawionych znaczników 2D na mapie.,Toggle the view of all 2D map markers.,Abilita / Disabilita la visione dei marcatori 2D in mappa,Activar la vista de todos los marcadores 2D,Bascule l'affichage de tous les marqueurs carte 2D.,切換你地圖上的所有自定2D視圖,Acesse a visualização de todos os seus marcadores de mapa 2D.,2D マーカー表示・非表示の切り替え,切换你地图上的所有自定2D视图
STR_EXPANSION_SETTINGS_CLIENT_MAP_SHOW2DCLIENTMARKERS,SHOW 2D PERSONAL MARKERS,SHOW 2D PERSONAL MARKERS,ZOBRAZIT OSOBNÍ 2D ZNAČKY,ZEIGE PERSONALISIERTE 2D MARKER,ПОКАЗАТЬ ЛИЧНЫЕ 2D МЕТКИ,POKAŻ MOJE ZNACZNIKI 2D,SHOW 2D PERSONAL MARKERS,MOSTRA MARCATORI PERSONALI 2D,Mostrar marcadores 2D personales,AFFICHER LES MARQUEURS 2D PERSONNELS,顯示個人2D標記,MOSTRAR MARCADORES PESSOAIS 2D,2D マーカーの表示,显示个人2D标记
STR_EXPANSION_SETTINGS_CLIENT_MAP_SHOW2DCLIENTMARKERS_DESC,Toggle the view of all personal 2D map markers.,Toggle the view of all personal 2D map markers.,Přepnout všechny osobní 2D značky.,Schalte die Anzeige von allen Personalisierten 2D Karten-Markierungen um.,Переключить вид всех меток персональной 2D-карты.,Włącz widok wszystkich moich ustawionych znaczników 2D na mapie.,Toggle the view of all personal 2D map markers.,Abilita / Disabilita la visione dei marcatori personali 2D in mappa,Activar la vista de tus marcadores 2D personales,Bascule l'affichage des marqueurs 2D personnels.,切換你地圖上的所有2D視圖個人,Alterne a visualização de todos os marcadores de mapa 2D pessoais.,2D マーカー表示・非表示の切り替え,切换你地图上的所有2D视图个人
STR_EXPANSION_SETTINGS_CLIENT_MAP_SHOW2DPLAYERMARKERS,SHOW 2D PLAYER MARKERS,SHOW 2D PLAYER MARKERS,ZOBRAZIT HRÁČSKÉ 2D ZNAČKY,ZEIGE 3D SPIELER-MARKER,ПОКАЗАТЬ 2D МЕТКИ ИГРОКА,POKAŻ ZNACZNIKI 2D GRACZA,SHOW 2D PLAYER MARKERS,MOSTRA MARCATORI 2D DEI GIOCATORI,Mostrar la vista de los marcadores 2D del Jugador,AFFICHER LES MARQUEURS 2D DE JOUEURS,顯示玩家標記,MOSTRAR MARCADORES 2D DOS JOGADORES,SHOW 2D PLAYER MARKERS,显示玩家标记
STR_EXPANSION_SETTINGS_CLIENT_MAP_SHOW2DPLAYERMARKERS_DESC,Toggle the view of all 2D party player markers.,Toggle the view of all 2D party player markers.,Přepnout všechny hráčské 2D značky.,Schalte die Anzeige von 2D Gruppen Spieler-Marierungen um.,Переключить вид всех 2D меток игрока.,Włącz widok wszystkich ustawionych znaczników osobowych 2D na mapie.,Toggle the view of all 2D party player markers.,Abilita / Disabilita la visione dei marcatori 2D dei giocatori nel gruppo,Activar marcadores 2D del Grupo,Bascule l'affichage des marqueurs 2D des membres de groupes.,切換地圖上所有隊伍中玩家的2D標記,Alterne a visualização de todos os marcadores de jogadores em 2D.,Toggle the view of all 2D party player markers.,切换地图上所有队伍中玩家的2D标记
STR_EXPANSION_SETTINGS_CLIENT_MAP_SHOW2DPARTYMARKERS,SHOW 2D PARTY MARKERS,SHOW 2D PARTY MARERS,ZOBRAZIT 2D ZNAČKY SKUPINY,ZEIGE 2D GRUPPEN MARKER,ПОКАЗАТЬ 2D МЕТКИ ГРУППЫ,POKAŻ ZNACZNIKI 2D GRUPY,SHOW 2D PARTY MARERS,MOSTRA MARCATORI 2D DI GRUPPO,Mostrar marcadores 2D del Grupo,AFFICHER LES MARQUEURS 2D DE GROUPE,顯示隊伍標記,MOSTRAR MARCADORES 2D DO GRUPO,SHOW 2D PARTY MARERS,显示队伍标记
STR_EXPANSION_SETTINGS_CLIENT_MAP_SHOW2DPARTYMARKERS_DESC,Toggle the view of all 2D party map markers.,Toggle the view of all 2D party map markers.,Přepnout všechny skupinové 2D značky.,Schalte die Anzeige von allen 2D Gruppen Karten-Markierungen um.,Переключить вид всех 2D меток группы на карте.,Włącz widok wszystkich ustawionych znaczników grupowych 2D na mapie.,Toggle the view of all 2D party map markers.,Abilita / Disabilita la visione dei marcatori 2D di gruppo,Mostrar marcadores 2D del Grupo en el mapa,Bascule l'affichage des marqueurs 2D du groupe.,切換所有隊伍中的2D標記,Alterne a exibição de todos os marcadores de mapa do grupo em 2D.,Toggle the view of all 2D party map markers.,切换所有队伍中的2D标记
STR_EXPANSION_SETTINGS_CLIENT_MAP_SHOW2DGLOBALMARKERS,SHOW 2D SERVER MARKERS,SHOW 2D SERVER MARKERS,ZOBRAZIT SERVEROVÉ 2D ZNAČKY,ZEIGE 2D SERVERMARKIERUNGEN,ПОКАЗАТЬ 2D СЕРВЕРНЫЕ МЕТКИ,POKAŻ ZNACZNIKI 2D SERWERA,SHOW 2D SERVER MARKERS,MOSTRA MARCATORI 2D DEL SERVER,Mostrar marcadores 2D del servidor,AFFICHER LES MARQUEURS 2D DU SERVEUR,顯示服務器2D標記,MOSTRAR MARCADORES 2D DO SERVIDOR,SHOW 2D SERVER MARKERS,显示服务器2D标记
STR_EXPANSION_SETTINGS_CLIENT_MAP_SHOW2DGLOBALMARKERS_DESC,Toggle the view of all global 2D server markers.,Toggle the view of all global 2D server markers.,Přepnout všechny serverové 2D značky.,Schalte die Anzeige von allen globalen 2D Server Markierungen um.,Переключить вид всех глобальных метки 2D сервера.,Włącz widok wszystkich ustawionych serwerowych znaczników 2D na mapie.,Toggle the view of all global 2D server markers.,Abilita / Disabilita la visione dei marcatori 2D creati per il server,Activar la vista de todos los marcadores 2D globales,Bascule l'affichage des marqueurs 2D du serveur.,切換服務器全局2D標記,Alterne a exibição de todos os marcadores globais de servidor 2D.,Toggle the view of all global 2D server markers.,切换服务器全局2D标记
STR_EXPANSION_SETTINGS_CLIENT_MAP_DEFAULTMARKERLOCK,LOCK NEW MAP MARKERS,LOCK NEW MAP MARKERS,LOCK NEW MAP MARKERS,SPERRE NEUE KARTENMARKIERUNGEN,LOCK NEW MAP MARKERS,LOCK NEW MAP MARKERS,LOCK NEW MAP MARKERS,LOCK NEW MAP MARKERS,LOCK NEW MAP MARKERS,LOCK NEW MAP MARKERS,LOCK NEW MAP MARKERS,LOCK NEW MAP MARKERS,LOCK NEW MAP MARKERS,
STR_EXPANSION_SETTINGS_CLIENT_MAP_DEFAULTMARKERLOCK_DESC,Enable if newly created map markers should be locked by default,Enable if newly created map markers should be locked by default,Enable if newly created map markers should be locked by default,"Aktivieren, wenn neu erstellte Kartenmarkierungen standardmäßig gesperrt werden sollen",Enable if newly created map markers should be locked by default,Enable if newly created map markers should be locked by default,Enable if newly created map markers should be locked by default,Enable if newly created map markers should be locked by default,Enable if newly created map markers should be locked by default,Enable if newly created map markers should be locked by default,Enable if newly created map markers should be locked by default,Enable if newly created map markers should be locked by default,Enable if newly created map markers should be locked by default,
STR_EXPANSION_SETTINGS_CLIENT_VEHICLES,VEHICLE SETTINGS,VEHICLE SETTINGS,NASTAVENÍ VEHIKLŮ,HELIKOPTEREINSTELLUNGEN,НАСТРОЙКИ ВЕРТОЛЁТА,USTAWIENIA HELIKOPTERA,VEHICLE SETTINGS,IMPOSTAZIONI VEICOLO,AJUSTES DE HELICOPTERO,OPTIONS DES HÉLICOPTÈRES,載具設定,OPÇÕES DE HELICÓPTERO,乗物設定,载具设定
STR_EXPANSION_SETTINGS_CLIENT_VEHICLES_FREELOOK,FIXED CAMERA,FIXED CAMERA,FIXNÍ KAMELA,KAMERA FIXIERT,КАМЕРА ЗАФИКСИРОВАНА,POPRAWIONA KAMERA,FIXED CAMERA,TELECAMERA FISSA,CAMARA FIJA,CAMÉRA FIXE,視角修正,CÂMERA FIXA,"視点切り替え
",视角修正
STR_EXPANSION_SETTINGS_CLIENT_VEHICLES_FREELOOK_DESC,Toggle static camera view in helicopters for a better flight control.,Toggle static camera view in helicopters for a better flight control.,Přepne statickou kameru v helikoptéře pro lepší kontrolu.,"Schalte die statische Kameraansicht, für bessere fliegen, um.",Для лучшего управления полётом можно зафиксировать камеру.,Włącz statyczny widok z helipoktera dla lepszej kontroli lotów,Toggle static camera view in helicopters for a better flight control.,Abilita / Disabilita una telecamera fissa per gli elicotteri. Potrebbe facilitarne l'utilizzo,Activar camara estatica en helicopteros para un mejor control en vuelo,Bascule la caméra statique en hélicoptère pour un meilleur pilotage.,靜態攝像機視角能夠幫助玩家更好的控制飛行。,Ativa a câmera estática em helicópteros para um melhor controle de vôo.,飛行をより楽に操作するために視点を切り替えられます,静态摄像机视角能够帮助玩家更好的控制飞行。
STR_EXPANSION_SETTINGS_CLIENT_VEHICLES_AUTOPILOT_RELATIVE_POSITIONING,AUTOPILOT - RELATIVE POSITIONING,AUTOPILOT - RELATIVE POSITIONING,AUTOPILOT - RELATIVNÍ POZICOVÁNÍ,AUTOPILOT - RELATIVE POSITIONING,АВТОПИЛОТ - ОТНОСИТЕЛЬНОЕ ПОЗИЦИОНИРОВАНИЕ,AUTOPILOT - POZYCJONOWANIE WZGLĘDNE,AUTOPILOT - RELATIVE POSITIONING,PILOTA AUTOMATICO - POSIZIONAMENTO RELATIVO,Piloto automatico - Posicionamiento Relativo,AUTO-PILOTE - POSTIONNEMENT RELATIF,自動駕駛-相對定位,PILOTO AUTOMÁTICO - POSICIONAMENTO RELATIVO,AUTOPILOT - RELATIVE POSITIONING,自动驾驶-相对定位
STR_EXPANSION_SETTINGS_CLIENT_VEHICLES_HELICOPTER_MOUSE_CONTROL,HELICOPTER MOUSE CONTROL,HELICOPTER MOUSE CONTROL,OVLÁDÁNÍ HELIKOPTÉRY MYŠÍ,HELICOPTER MOUSE CONTROL,ВЕРТОЛЁТ УПРАВЛЕНИЕ МЫШЬЮ,Sterowanie Śmigłowca Myszką,HELICOPTER MOUSE CONTROL,CONTROLLA ELICOTTERO CON IL MOUSE,Control de helicoptero con ratón,CONTRÔLE DE L'HÉLICOPTÈRE À LA SOURIS,直升機鼠標控制,HELICÓPTERO - CONTROLE POR MOUSE,HELICOPTER MOUSE CONTROL,直升机鼠标控制
