LANGUAGE,ORIGINAL,ENGLISH,CZECH,GERMAN,RUSSIAN,POLISH,HUNGARIAN,ITALIAN,SPANISH,FRENCH,CHINESE,PORTUGUESE,JAPANESE,CHINESE SIMP.
STR_EXPANSION_SETTINGS_CLIENT_VEHICLES_HELICOPTER_MOUSE_CONTROL_DESC,"Allows you to control aerial vehicles with the mouse. When enabled, you can toggle freelook with a configurable key (default LEFT ALT).","Allows you to control aerial vehicles with the mouse. When enabled, you can toggle freelook with a configurable key (default LEFT ALT).","Umožní kontrolovat letadla pomocí myši. When enabled, you can toggle freelook with a configurable key (default LEFT ALT).","Ermöglicht es, Luftfahrzeuge mit der Maus zu steuern. Wenn aktiviert, kann mit einer konfigurierbaren Taste (Standard ALT LINKS) die freie Kamera umgeschaltet werden.","Позволяет управлять воздушными транспортными средствами с помощью мыши. Если эта функция включена, вы можете переключать freelook с помощью настраиваемой клавиши (по умолчанию LEFT ALT)","Umożliwia sterowanie pojazdami powietrznymi za pomocą myszy. When enabled, you can toggle freelook with a configurable key (default LEFT ALT).","Allows you to control aerial vehicles with the mouse. When enabled, you can toggle freelook with a configurable key (default LEFT ALT).","Permette di controllare aerei ed elicotteri con il mouse. When enabled, you can toggle freelook with a configurable key (default LEFT ALT).","te permite controlar el helicoptero con un ratón. When enabled, you can toggle freelook with a configurable key (default LEFT ALT).","Allows you to control aerial vehicles with the mouse. When enabled, you can toggle freelook with a configurable key (default LEFT ALT).","允許你使用鼠標操作相應載具 When enabled, you can toggle freelook with a configurable key (default LEFT ALT).","Permite controlar veículos aéreos com o mouse. When enabled, you can toggle freelook with a configurable key (default LEFT ALT).","Allows you to control aerial vehicles with the mouse. When enabled, you can toggle freelook with a configurable key (default LEFT ALT).",允许你使用鼠标操作相应载具 启用后，您可以使用可配置的键（默认为 LEFT ALT）切换自由外观。
STR_EXPANSION_SETTINGS_CLIENT_VEHICLES_PLANE_MOUSE_CONTROL,PLANE MOUSE CONTROL,PLANE MOUSE CONTROL,OVLÁDÁNÍ LETADEL MYŠÍ,PLANE MOUSE CONTROL,САМОЛЁТ УПРАВЛЕНИЕ МЫШЬЮ,Sterowania Samolotu Myszką,PLANE MOUSE CONTROL,CONTROLLA AEREO CON IL MOUSE,control de avión con ratón,CONTRÔLE DE L'AVION À LA SOURIS,飛機鼠標控制,AVIÃO - CONTROLE POR MOUSE,PLANE MOUSE CONTROL,飞机鼠标控制
STR_EXPANSION_SETTINGS_CLIENT_VEHICLES_PLANE_MOUSE_CONTROL_DESC,,,,,,,,,te permite controlar el avion con un ratón,,,Permite controlar veículos aéreos com o mouse.,,
STR_EXPANSION_SETTINGS_CLIENT_VEHICLES_MOUSE_CONTROL_INVERTED,INVERTED MOUSE CONTROL,INVERTED MOUSE CONTROL,OBRÁCENÝ POHYB MYŠI,INVERTED MOUSE CONTROL,ИНВЕРТИРОВАТЬ УПРАВЛЕНИЕ МЫШЬЮ,ODWRÓCONA KONTROLA MYSZY,INVERTED MOUSE CONTROL,CONTROLLI MOUSE INVERTITI,Control con raton invertido,CONTRÔLE DE SOURIS INVERSÉ,翻轉鼠標控件,INVENTER CONTROLE POR MOUSE,INVERTED MOUSE CONTROL,翻转鼠标控件
STR_EXPANSION_SETTINGS_CLIENT_VEHICLES_MOUSE_CONTROL_DESC_INVERTED,Inverts pitch controls when mouse controls are enabled.,Inverts pitch controls when mouse controls are enabled.,Obrátí kontrolu náklonu v módu kontroly s myší.,Inverts pitch controls when mouse controls are enabled.,"Инвертирует элементы управления высотой, когда управление мышью включено.","Odwraca sterowanie wysokością, gdy włączone są elementy sterujące myszy.",Inverts pitch controls when mouse controls are enabled.,Inverte il beccheggio quando i controlli con il mouse sono abilitati,Invierte los controles de las palas cuando el control con raton esta encendido,Inverse les commandes de tangage lorsque les commandes de la souris sont activées.,啟用鼠標控件時反轉俯仰控件。,Inverte os controles dos veículos quando os controles do mouse estão ativados.,Inverts pitch controls when mouse controls are enabled.,启用鼠标控件时反转俯仰控件。 
STR_EXPANSION_SETTINGS_CLIENT_VEHICLES_HELICOPTER_MOUSE_VERTICAL,VERTICAL MOUSE CONTROL,VERTICAL MOUSE CONTROL,VERTICAL MOUSE CONTROL,VERTICAL MOUSE CONTROL,ВЕРТИКАЛЬНОЕ УПРАВЛЕНИЕ МЫШЬЮ,VERTICAL MOUSE CONTROL,VERTICAL MOUSE CONTROL,CONTROLLO VERICALE COL MOUSE,CONTROL DE MOUSE VERTICAL,CONTRÔLE DE LA SOURIS VERTICALE,垂直鼠標控制,VERTICAL MOUSE CONTROL,VERTICAL MOUSE CONTROL,垂直鼠标控制
STR_EXPANSION_SETTINGS_CLIENT_VEHICLES_HELICOPTER_MOUSE_VERTICAL_DESC,Sensibility of the vertical axis of the mouse while flying a Helicopter,Sensibility of the vertical axis of the mouse while flying a Helicopter,Sensibility of the vertical axis of the mouse while flying a Helicopter,Sensibility of the vertical axis of the mouse while flying a Helicopter,Чувствительность вертикальной оси мыши при полете на вертолете,Sensibility of the vertical axis of the mouse while flying a Helicopter,Sensibility of the vertical axis of the mouse while flying a Helicopter,Sensibilità dell'asse verticale del mouse usando gli elicotteri,Sensibilidad del eje vertical del mouse al volar un helicóptero,Sensibilité de l'axe vertical de la souris en pilotant un hélicoptère,飛行直升機時鼠標垂直軸的靈敏度,Sensibility of the vertical axis of the mouse while flying a Helicopter,Sensibility of the vertical axis of the mouse while flying a Helicopter,飞行直升机时鼠标垂直轴的灵敏度
STR_EXPANSION_SETTINGS_CLIENT_VEHICLES_HELICOPTER_MOUSE_HORIZONTAL,HORIZONTAL MOUSE CONTROL,HORIZONTAL MOUSE CONTROL,HORIZONTAL MOUSE CONTROL,HORIZONTAL MOUSE CONTROL,ГОРИЗОНТАЛЬНОЕ УПРАВЛЕНИЕ МЫШЬЮ,HORIZONTAL MOUSE CONTROL,HORIZONTAL MOUSE CONTROL,CONTROLLO ORIZZONTALE COL MOUSE,CONTROL DE MOUSE HORIZONTAL,CONTRÔLE DE LA SOURIS HORIZONTAL,水平鼠標控制,HORIZONTAL MOUSE CONTROL,HORIZONTAL MOUSE CONTROL,水平鼠标控制
STR_EXPANSION_SETTINGS_CLIENT_VEHICLES_HELICOPTER_MOUSE_HORIZONTAL_DESC,Sensibility of the horizontal axis of the mouse while flying a Helicopter,Sensibility of the horizontal axis of the mouse while flying a Helicopter,Sensibility of the horizontal axis of the mouse while flying a Helicopter,Sensibility of the horizontal axis of the mouse while flying a Helicopter,Чувствительность горизонтальной оси мыши при полете на вертолете,Sensibility of the horizontal axis of the mouse while flying a Helicopter,Sensibility of the horizontal axis of the mouse while flying a Helicopter,Sensibilità dell'asse orizzontale usando gli elicotteri,Sensibilidad del eje horizontal del mouse al volar un helicóptero,Sensibilité de l'axe horizontal de la souris en pilotant un hélicoptère,飛行直升機時鼠標水平軸的靈敏度,Sensibility of the horizontal axis of the mouse while flying a Helicopter,Sensibility of the horizontal axis of the mouse while flying a Helicopter,飞行直升机时鼠标水平轴的灵敏度
STR_EXPANSION_SETTINGS_CLIENT_VEHICLES_HELICOPTER_TURN_OFF_AUTOHOVER_DURING_FLIGHT,AUTO-HOVER OFF IN FLIGHT,AUTO-HOVER OFF IN FLIGHT,AUTO-HOVER OFF IN FLIGHT,AUTO-HOVER AUS BEIM FLUG,AUTO-HOVER OFF IN FLIGHT,AUTO-HOVER OFF IN FLIGHT,AUTO-HOVER OFF IN FLIGHT,AUTO-HOVER OFF IN FLIGHT,AUTO-HOVER OFF IN FLIGHT,AUTO-HOVER OFF IN FLIGHT,AUTO-HOVER OFF IN FLIGHT,AUTO-HOVER OFF IN FLIGHT,AUTO-HOVER OFF IN FLIGHT,
STR_EXPANSION_SETTINGS_CLIENT_VEHICLES_HELICOPTER_TURN_OFF_AUTOHOVER_DURING_FLIGHT_DESC,Automatically turns off auto-hover when you manipulate pitch or roll controls.,Automatically turns off auto-hover when you manipulate pitch or roll controls.,Automatically turns off auto-hover when you manipulate pitch or roll controls.,Schaltet Auto-Hover automatisch ab bei Änderung der Neigung oder des Rollwinkels durch Steuerungseingabe.,Automatically turns off auto-hover when you manipulate pitch or roll controls.,Automatically turns off auto-hover when you manipulate pitch or roll controls.,Automatically turns off auto-hover when you manipulate pitch or roll controls.,Automatically turns off auto-hover when you manipulate pitch or roll controls.,Automatically turns off auto-hover when you manipulate pitch or roll controls.,Automatically turns off auto-hover when you manipulate pitch or roll controls.,Automatically turns off auto-hover when you manipulate pitch or roll controls.,Automatically turns off auto-hover when you manipulate pitch or roll controls.,Automatically turns off auto-hover when you manipulate pitch or roll controls.,
STR_EXPANSION_SETTINGS_CLIENT_VIDEO,VIDEO SETTINGS,VIDEO SETTINGS,GRAFICKÉ NASTAVENÍ,VIDEO SETTINGS,НАСТРОЙКИ ВИДЕО,USTAWIENIA WIDEO,VIDEO SETTINGS,IMPOSTAZIONI VIDEO,Ajustes Graficos,OPTIONS VIDEOS,視頻設定,OPÇÕES DE VÍDEO,VIDEO SETTINGS,视频设定
STR_EXPANSION_SETTINGS_CLIENT_VIDEO_DRAWDISTANCE,DRAW DISTANCE,DRAW DISTANCE,VZDÁLENOST DOHLEDU,DRAW DISTANCE,ДИСТАНЦИЯ ПРОРИСОВКИ,DYSTANS ŁADOWANIA TERENU,DRAW DISTANCE,DISTANZA DI RENDERING,Distancia de Dibujado,DISTANCE D'AFFICHAGE,渲染距離,CAMPO DE VISÃO,DRAW DISTANCE,渲染距离
STR_EXPANSION_SETTINGS_CLIENT_VIDEO_DRAWDISTANCE_DESC,Increase or normalize draw distance.,Increase or normalize draw distance.,"Zvýši či normalizuje vzdálenost, na kterou lze dohlédnout.",Increase or normalize draw distance.,Увеличьте или нормализуйте расстояние прорисовки.,Zwiększ lub znormalizuj odległość ładowania terenu.,Increase or normalize draw distance.,Aumenta o normalizza la distanza di Rendering,Incrementar o normalizar la distancia de dibujado,Increase or normalize draw distance.,增大或規格化繪圖距離,Aumente ou normalize a distância da visão.,Increase or normalize draw distance.,增大或规格化绘图距离
STR_EXPANSION_SETTINGS_CLIENT_VIDEO_COLORGRADING,COLOR GRADING,COLOR GRADING,KOREKCE BAREV,COLOR GRADING,Цветовая градация,GRADACJA KOLORÓW,COLOR GRADING,COLOR GRADING,Graduado del color,COLOR GRADING,顏色增強,GRADAÇÃO DE CORES,COLOR GRADING,颜色增强
STR_EXPANSION_SETTINGS_CLIENT_VIDEO_COLORGRADING_DESC,"When enabled, increasing saturation of the game.","When enabled, increasing saturation of the game.",Zvýší barevnost hry.,"When enabled, increasing saturation of the game.",При включении увеличивается насыщенность игры.,Po włączeniu zwiększa nasycenie gry.,"When enabled, increasing saturation of the game.","Se abilitato, aumenta la saturazione nel gioco",Cuando esta activado incrementa la saturación del juego,"Lorsqu'il est activé, augmente la saturation du jeu.",啟用時，增加遊戲的飽和度。,"Quando ativado, aumenta a saturação do jogo.","When enabled, increasing saturation of the game.",启用时，增加游戏的饱和度。 
STR_EXPANSION_SETTINGS_CLIENT_VIDEO_COLORVIGNETTE,COLOR VIGNETTE,COLOR VIGNETTE,BAREVNÁ VINĚTA,COLOR VIGNETTE,Виньетирование,WINIETA,COLOR VIGNETTE,VIGNETTA,Viñeta del color,COLOR VIGNETTE,色彩熏暈圖,COR VINHETA,COLOR VIGNETTE,色彩熏晕图
STR_EXPANSION_SETTINGS_CLIENT_VIDEO_COLORVIGNETTE_DESC,"When enabled, applies vignette effect on the camera.","When enabled, applies vignette effect on the camera.",Přidá vinětu na kameře.,"When enabled, applies vignette effect on the camera.",При включении применяет эффект виньетки к камере.,Po włączeniu stosuje efekt winiety na kamerze.,"When enabled, applies vignette effect on the camera.","Se abilitato, applica un effetto vignettatura alla telecamera",Cuando esta activado aplica el efecto viñeta a la camara,"Lorsqu'il est activé, applique un effet de vignette sur la caméra.",啟用時，在相機上應用漸暈效果。,"Quando ativado, aplica o efeito de vinheta na câmera.","When enabled, applies vignette effect on the camera.",启用时，在相机上应用渐晕效果。 
STR_EXPANSION_SETTINGS_CLIENT_VIDEO_LIGHTSHADOWS,CAST SHADOWS,CAST SHADOWS,VRHÁNÍ STÍNŮ,CAST SHADOWS,АКТИВНЫЕ ТЕНИ,RZUCANIE CIENI,CAST SHADOWS,PROIETTA OMBRE,Mostrar Sombras,AFFICHER LES OMBRES,陰影,PROJETAR SOMBRAS,CAST SHADOWS,阴影
STR_EXPANSION_SETTINGS_CLIENT_VIDEO_LIGHTSHADOWS_DESC,Toggles the casting of light shadows for the street light.,Toggles the casting of shadows for the street lights.,Zapne vrhání stínů u lamp.,Toggles the casting of shadows for the street lights.,Включает отбрасывание теней для уличных фонарей.,Przełącza rzucanie cieni na światła uliczne.,Toggles the casting of shadows for the street lights.,Abilita / Disabilita la proiezione delle ombre dalle luci in strada,Activa las sombras con luz de las farolas,Bascule la projection d'ombres pour les lampadaires.,是否啟用路燈的陰影效果.,Alterna a projeção de sombras para as luzes da rua.,Toggles the casting of shadows for the street lights.,是否启用路灯的阴影效果.
STR_EXPANSION_SETTINGS_CLIENT_MARKET,MARKET SETTINGS,MARKET SETTINGS,MARKET SETTINGS,MARKET SETTINGS,ПАРАМЕТРЫ РЫНКА,MARKET SETTINGS,MARKET SETTINGS,IMPOSTAZIONI MERCATO,OPCIONES DEL MERCADO,PARAMÈTRES DU MARCHÉ,MARKET SETTINGS,MARKET SETTINGS,MARKET SETTINGS,市场环境
STR_EXPANSION_SETTINGS_CLIENT_MARKET_SHOWCURRENCYDENOMS,SHOW CURRENCY DENOMINATIONS,SHOW CURRENCY DENOMINATIONS,SHOW CURRENCY DENOMINATIONS,SHOW CURRENCY DENOMINATIONS,ПОКАЗЫВАТЬ НОМИНАЛЫ ВАЛЮТ,SHOW CURRENCY DENOMINATIONS,SHOW CURRENCY DENOMINATIONS,MOSTRA DENOMINAZIONI DI VALUTA,MOSTRAR DENOMINACIONES DE MONEDA,AFFICHER LES DÉNOMINATIONS DES MONNAIES,SHOW CURRENCY DENOMINATIONS,SHOW CURRENCY DENOMINATIONS,SHOW CURRENCY DENOMINATIONS,显示货币面额
STR_EXPANSION_SETTINGS_CLIENT_MARKET_SHOWCURRENCYDENOMS_DESC,"When enabled, this displays the price of a market item with all its denominations under the total price in the detailed item section of the market menu.","When enabled, this displays the price of a market item with all its denominations under the total price in the detailed item section of the market menu.","When enabled, this displays the price of a market item with all its denominations under the total price in the detailed item section of the market menu.","When enabled, this displays the price of a market item with all its denominations under the total price in the detailed item section of the market menu.","Если эта функция включена, она отображает цену рыночного товара со всеми его номиналами под общей ценой в разделе подробной информации о товаре в меню рынка.","When enabled, this displays the price of a market item with all its denominations under the total price in the detailed item section of the market menu.","When enabled, this displays the price of a market item with all its denominations under the total price in the detailed item section of the market menu.","Quando abilitato mostra sotto al prezzo totale, il prezzo con tutte le denominazioni di valuta","Cuando está habilitado, muestra el precio de un artículo de mercado con todas sus denominaciones bajo el precio total en la sección detallada del artículo.","Lorsqu'il est activé, cela affiche le prix d'un article du marché avec toutes ses dénominations sous le prix total dans la section détaillée de l'article du menu du marché.","When enabled, this displays the price of a market item with all its denominations under the total price in the detailed item section of the market menu.","When enabled, this displays the price of a market item with all its denominations under the total price in the detailed item section of the market menu.","When enabled, this displays the price of a market item with all its denominations under the total price in the detailed item section of the market menu.",启用后，它会在市场菜单的详细项目部分中的总价下显示市场项目的价格及其所有面额。
STR_EXPANSION_SETTINGS_NOTIFICATIONS,NOTIFICATION SETTINGS,NOTIFICATION SETTINGS,NASTAVENÍ OZNÁMENÍ,BENACHRICHTIGUNGSEINSTELLUNGEN,НАСТРОЙКИ УВЕДОМЛЕНИЙ,USTAWIENIA POWIADOMIEŃ,NOTIFICATION SETTINGS,IMPOSTAZIONI DELLE NOTIFICHE,AJUSTES DE NOTIFICACIONES,OPTIONS DES NOTIFICATIONS,通知設置,OPÇÕES DE NOTIFICAÇÃO,通知設定,通知设置
STR_EXPANSION_SETTINGS_NOTIFICATIONS_DISPLAY,DISPLAY NOTIFICATIONS,DISPLAY NOTIFICATIONS,ZOBRAZIT OZNÁMENÍ,DISPLAY NOTIFICATIONS,ПОКАЗАТЬ УВЕДОМЛЕНИЯ,POWIADOMIENIA NA WYŚWIETLACZU,DISPLAY NOTIFICATIONS,MOSTRA NOTIFICHE,Mostrar Notificaciones,AFFICHAGE DES NOTIFICATIONS,顯示提醒,MOSTRAR NOTIFICAÇÕES,DISPLAY NOTIFICATIONS,显示提醒
STR_EXPANSION_SETTINGS_NOTIFICATIONS_DISPLAY_DESC,Toggle all notifications.,Toggle all notifications.,Zobrazit všechny oznámení.,Toggle all notifications.,Переключить все уведомления.,Przełącz wszystkie powiadomienia.,Toggle all notifications.,Abilita / Disabilita tutte le notifiche,Toggle all notifications.,Bascule l'affichage des notifications.,顯示所有提醒,Ativa todas as notificações.,Toggle all notifications.,显示所有提醒
STR_EXPANSION_SETTINGS_NOTIFICATIONS_SOUND,NOTIFICATION SOUND,NOTIFICATION SOUND,ZVUK OZNÁMENÍ,"BENACHRICHTIGUNGSTON
",ЗВУК УВЕДОМЛЕНИЙ,DŹWIĘKI POWIADOMIEŃ,NOTIFICATION SOUND,SUONO DI NOTIFICA,NOTIFICACIÓN CON SONIDO,SON DES NOTIFICATIONS,通知聲音,SOM DE NOTIFICAÇÃO,通知音,通知声音
STR_EXPANSION_SETTINGS_NOTIFICATIONS_SOUND_DESC,Toggle sounds for all notification messages.,Toggle sounds for all notification messages.,Přepnout zvuky pro všechny oznámení.,Schalte den Ton für alle Benachrichtigungs Nachrichten um.,Вкл/Выкл звуки всех уведомлений.,Włącz dźwięki wszystkich powiadomień,Toggle sounds for all notification messages.,Abilita / Disabilita i suoni per tutte le notifiche,Activar sonido para todas las notificaciones,Bascule le son pour toutes les notifications.,為所有的提示通知設置聲音,Altera o som para todas as mensagens de notificação.,通知音を有効・無効にすることができます,为所有的提示通知设置声音
STR_EXPANSION_SETTINGS_NOTIFICATIONS_SOUND_LEAVE_JOIN,NOTIFICATION SOUND LEAVE/JOIN,NOTIFICATION SOUND LEAVE/JOIN,ZVUK OZNÁMENÍ PRO LEAVE A JOIN,NOTIFICATION SOUND LEAVE/JOIN,ЗВУКОВОЕ УВЕДОМЛЕНИЕ ПРИ  ВЫХОДЕ/ПРИСОЕДИНЕНИИ,POWIADOMIENIE DŹWIĘKOWE OPUSZCZENIE/DOŁĄCZENIE,NOTIFICATION SOUND LEAVE/JOIN,SUONO DI NOTIFICA ENTRATA / USCITA,NOTIFICATION SOUND LEAVE/JOIN,SON DES NOTIFICATIONS CONNEXION/DECONNEXION,加入/離開的提示音,SOM DE NOTIFICAÇÃO (SAIR/ENTRAR),NOTIFICATION SOUND LEAVE/JOIN,加入/离开的提示音
STR_EXPANSION_SETTINGS_NOTIFICATIONS_SOUND_LEAVE_JOIN_DESC,Toggle sounds for leave/join notification messages.,Toggle sounds for leave/join notification messages.,Přepne zvuk oznámení pro leave či join.,Toggle sounds for leave/join notification messages.,Переключить звуки для уведомлений о выходе / присоединении.,Przełącz dźwięki powiadomień o opuszczeniu / dołączeniu.,Toggle sounds for leave/join notification messages.,Abilita / Disabilita i suoni per tutte le notifiche di entrata ed uscita,Activar los sonidos para unirse o salir en las notificaciones.,Bascule le son pour les notifications de Connexion/Déconnexion,是否打開加入/離開的提示音.,Ativa o som das notificações de saída e entrada de jogadores.,Toggle sounds for leave/join notification messages.,是否打开加入/离开的提示音.
STR_EXPANSION_SETTINGS_NOTIFICATIONS_JOIN,SHOW PLAYERS JOINING,SHOW PLAYERS JOINING,ZOBRAZIT PŘIPOJUJÍCÍ SE HRÁČE,ZEIGE SPIELER DIE BEITRETEN,ПОКАЗАТЬ ПРИСОЕДИНЯЮЩИХСЯ ИГРОКОВ,POKAŻ DOŁĄCZAJĄCYCH GRACZY,SHOW PLAYERS JOINING,MOSTRA GIOCATORI ENTRANTI,MOSTRAR JUGADORES UNIÉNDOSE,AFFICHER LES JOUEURS QUI REJOIGNENT LE SERVEUR,顯示玩家加入,MOSTRAR JOGADORES ENTRANDO,"プレーヤー参加時に表示
",显示玩家加入
STR_EXPANSION_SETTINGS_NOTIFICATIONS_JOIN_DESC,Toggle the view of all player join notifications.,Toggle the view of all player join notifications.,Přepnout všechny oznámení o připojujících se hráčích.,"Schalte die Anzeige für Beitrittsbenachrichtigung um.

",Вкл/Выкл уведомления о присоединении игроков.,Włącz powiadomienia gdy gracz dołączy na serwer,Toggle the view of all player join notifications.,Abilita / Disabilita la visione per tutte le notifiche di entrata dei giocatori,Activar las notificaciones de todos los jugadores que se unen,Bascule l'affichage des notifications de tous les joueurs qui rejoignent le serveur.,切換來顯示所有玩家的加入信息,Altera a visualização de notificação de todos os jogadores entrando,プレーヤーが参加した時に通知を表示・非表示,切换来显示所有玩家的加入信息
STR_EXPANSION_SETTINGS_NOTIFICATIONS_LEAVE,SHOW PLAYERS LEAVING,SHOW PLAYERS LEAVING,ZOBRAZIT ODCHÁZEJÍCÍ HRÁČE,ZEIGE SPIELER DIE VERLASSEN,ПОКАЗАТЬ ВЫХОДЯЩИХ ИГРОКОВ,POKAŻ WYCHODZĄCYCH GRACZY,SHOW PLAYERS LEAVING,MOSTRA GIOCATORI USCENTI,MOSTRAR JUGADORES SALIENDO,AFFICHER LES JOUEURS QUI QUITTENT LE SERVEUR,顯示玩家離開,MOSTRAR JOGADORES SAINDO,"プレーヤー退出時に表示
",显示玩家离开
STR_EXPANSION_SETTINGS_NOTIFICATIONS_LEAVE_DESC,Toggle the view of all player leave notifications.,Toggle the view of all player leave notifications.,Přepnout všechny oznámení o odpojujících se hráčích.,"Schalte die Anzeige für Verlassensbenachrichtigung um.

",Вкл/Выкл уведомления о выходе игроков.,Włącz powiadomienia gdy gracz wyjdzie z serwera,Toggle the view of all player leave notifications.,Abilita / Disabilita la visione per tutte le notifiche di uscita dei giocatori,Activar las notificaciones de todos los jugadores que se salen,Bascule l'affichage des notifications de tous les joueurs qui quittent le serveur.,切換來顯示所有玩家的離開信息,Altera a visualização de notificação de todos os jogadores saindo,プレーヤーが退出した時に通知を表示・非表示,切换来显示所有玩家的离开信息
STR_EXPANSION_SETTINGS_HUD,HUD SETTINGS,HUD SETTINGS,NASTAVENÍ HUDU,HUD-EINSTELLUNGEN,НАСТРОЙКИ ИНТЕРФЕЙСА,USTAWIENIA HUD,HUD SETTINGS,IMPOSTAZIONI HUD,AJUSTES DE HUD,OPTIONS DU HUD,面板設定,OPÇÕES DE TELA,HUD 設定,面板设定
STR_EXPANSION_SETTINGS_HUD_SHOW_CLOCK,SHOW CLOCK,SHOW CLOCK,UKÁZAT HODINY,ZEIGE UHR,ПОКАЗАТЬ ЧАСЫ,POKAŻ ZEGAR,SHOW CLOCK,MOSTRA OROLOGIO,MOSTRAR RELOJ,AFFICHER L'HORLOGE,顯示鐘,MOSTRAR RELÓGIO,時計を表示,显示钟
STR_EXPANSION_SETTINGS_HUD_SHOW_CLOCK_DESC,Toggle the view of all player leave notifications.,Toggle the view of the clock in the main user interface.,Přepnout hodiny v rámci UI.,Schalte die Ansicht der Uhr im Benutzerfeld um.,Вкл/Выкл отображение часов в интерфейсе.,Włącz widok zegara w głownym interfejsie,Toggle the view of the clock in the main user interface.,Abilita / Disabilita la visione nell'orologio nell'interfaccia,Selecciona la vista del reloj en la interfaz de usuario.,Bascule l'affichage de l'horloge dans l'interface utilisateur principale.,在用戶主界面中切換時鐘視圖。,Altera a visão do relógio no usuário principal.,時計の表示・非表示を設定,在用户主界面中切换时钟视图。
STR_EXPANSION_SETTINGS_HUD_SHOW_HUMANITY,SHOW HUMANITY,SHOW HUMANITY,UKÁZAT HUMANITU,ZEIGE MENSCHLICHKEIT,ПОКАЗАТЬ ЧЕЛОВЕЧНОСТЬ,POKAŻ CZŁOWIECZEŃSTWO,SHOW HUMANITY,MOSTRA UMANITA',MOSTRAR HUMANIDAD,AFFICHER L'HUMANITÉ,顯示人性,MOSTRAR HUMANIDADE,ヒューマニティ表示,显示人性
STR_EXPANSION_SETTINGS_HUD_SHOW_HUMANITY_DESC,MISC SETTINGS,Toggle the view of the humanity indicator in the main user interface.,Přepnout indikátor humanity.,Schalte die Ansicht des Menschlichkeitsindikator um.,Вкл/Выкл индикатор человечности в интерфейсе.,Włącz widok wskaźnika człowieczeństwa w głownym interfejsie,Toggle the view of the humanity indicator in the main user interface.,Abilita / Disabilita la visione dell'umanità nell'interfaccia,AJUSTES GENERALES,Bascule l'affichage de l'indicateur d'humanité dans l'interface utilisateur principale.,在用戶主界面中顯示人性陣營。,Altera a visão do indicador de humanidade no usuário principal.,ヒューマニティの表示・非表示を設定,在用户主界面中显示人性阵营。
STR_EXPANSION_SETTINGS_HUD_SHOW_GPS,SHOW GPS,SHOW GPS,UKÁZAT GPS,ZEIGE DAS GPS,ПОКАЗАТЬ GPS,Pokaż GPS,SHOW GPS,MOSTRA GPS,MOSTRAR GPS,AFFICHER GPS,顯示GPS,MOSTRAR GPS,SHOW GPS,显示GPS
STR_EXPANSION_SETTINGS_HUD_SHOW_GPS_DESC,Toggle the view of the GPS.,Toggle the view of the GPS.,Přepnout náhled do GPS.,Schalte die Ansicht des GPS um.,Переключить отображение GPS,Przęłącz widoczność GPS,Toggle the view of the GPS.,Abilita / Disabilita la visione del GPS,Activar la visión del GPS,Bascule l'affichage du GPS,切換GPS顯示畫面,Ativa a visão do GPS.,Toggle the view of the GPS.,切换GPS显示画面
