LANGUAGE,ORIGINAL,ENGLISH,CZECH,GERMAN,RUSSIAN,POLISH,HUNGARIAN,ITALIAN,SPANISH,FRENCH,CHINESE,PORTUGUESE,JAPANESE,CHINESE SIMP.
STR_EXPANSION_SETTINGS_HUD_EARPLUG_LEVEL,EARPLUG LEVEL,EARPLUG LEVEL,ÚROVEŇ ŠPUNTŮ DO UŠÍ,EARPLUG LEVEL,ГРОМКОСТЬ В БЕРУШАХ,Poziom Zatyczek,EARPLUG LEVEL,LIVELLO TAPPI AURICOLARI,Nivel de los tapones de oido,EARPLUG LEVEL,耳塞級別,TAMPÃO DE OUVIDO - NÍVEL,EARPLUG LEVEL,耳塞级别
STR_EXPANSION_SETTINGS_HUD_EARPLUG_LEVEL_DESC,Change earplug level,Change earplug level,Změnit úroveň špuntů do uší.,Change earplug level,Изменить громкость в берушах,Zmień Poziom Zatyczek,Change earplug level,Cambia il volume percepito con i tappi auricolari,Cambiar el nivel de los tapones de oido,Change earplug level,更改耳塞級別,Altera o nível do tampão de ouvido.,Change earplug level,更改耳塞级别
STR_EXPANSION_SETTINGS_HUD_ALPHA_HEAD_PLAYER,ALPHA MARKER PARTY MEMBER,ALPHA MARKER PARTY MEMBER,PRŮHLEDNOST 3D ZNAČKY,ALPHA MARKER PARTY MEMBER,ПРОЗРАЧНОСТЬ МЕТОК ИГРОКОВ В ГРУППЕ,PRZEZROCZYSTOŚĆ ZNACZNIKÓW CZŁONKA GRUPY,ALPHA MARKER PARTY MEMBER,ALPHA MARCATORI DEI GIOCATORI,Marcador Alpha para miembro del grupo,ALPHA MARKER PARTY MEMBER,阿爾法派對會員,MARCAÇÃO DO PLAYER ALPHA DO GRUPO,ALPHA MARKER PARTY MEMBER,阿尔法派对会员
STR_EXPANSION_SETTINGS_HUD_ALPHA_HEAD_PLAYER_DESC,Change alpha level of marker for party member,Change alpha level of marker for party member,Změnit průhlednost na značce.,Change alpha level of marker for party member,Изменить прозрачность меток игроков в группе,Zmień przezroczystość znaczników dla członka grupy,Change alpha level of marker for party member,Cambia il livello Alpha (trasparenza) dei marcatori dei giocatori nel gruppo.,Cambiar marcador Alpha para miembro del grupo,Change alpha level of marker for party member,更改派對成員的標記的Alpha等級,Alterar o nível alfa do marcador do membro do grupo.,Change alpha level of marker for party member,更改派对成员的标记的Alpha等级
STR_EXPANSION_SETTINGS_HUD_RED_HEAD_PLAYER,RED MARKER PARTY MEMBER,RED MARKER PARTY MEMBER,ČERVENÁ ČÁST PARTY ZNAČKY,RED MARKER PARTY MEMBER,УРОВЕНЬ КРАСНОГО ДЛЯ МЕТОК ГРУППЫ,CZERWIEŃ ZNACZNIKA CZŁONKA GRUPY,RED MARKER PARTY MEMBER,ROSSO MARCATORI DEI GIOCATORI,Marcador rojo para miembro del grupo,RED MARKER PARTY MEMBER,紅旗派對會員,MARCAÇÃO VERMELHA DO MEMBRO DO GRUPO.,RED MARKER PARTY MEMBER,红旗派对会员
STR_EXPANSION_SETTINGS_HUD_RED_HEAD_PLAYER_DESC,Change red level of marker for party member,Change red level of marker for party member,Změnit podíl červené barvy na značce.,Change red level of marker for party member,Изменить уровень красного для меток группы,Zmień czerwony poziom znacznika dla członka grupy,Change red level of marker for party member,Cambia il livello di Rosso nei marcatori dei giocatori nel gruppo.,Cambiar marcador rojo para miembro del grupo,Change red level of marker for party member,更改黨員的紅色標記,Alterar o nível vermelho de marcador para membro do grupo,Change red level of marker for party member,更改党员的红色标记
STR_EXPANSION_SETTINGS_HUD_GREEN_HEAD_PLAYER,GREEN MARKER PARTY MEMBER,GREEN MARKER PARTY MEMBER,ZELENÁ ČÁST PARTY ZNAČKY,GREEN MARKER PARTY MEMBER,УРОВЕНЬ ЗЕЛЁНОГО ДЛЯ МЕТОК ГРУППЫ,ZIELEŃ ZNACZNIKA CZŁONKA GRUPY,GREEN MARKER PARTY MEMBER,VERDE MARCATORI DEI GIOCATORI,Marcador verde para miembro del grupo,GREEN MARKER PARTY MEMBER,綠色市場黨員,MARCAÇÃO VERDE DO MEMBRO DO GRUPO.,GREEN MARKER PARTY MEMBER,绿色市场党员
STR_EXPANSION_SETTINGS_HUD_GREEN_HEAD_PLAYER_DESC,Change green level of marker for party member,Change green level of marker for party member,Změnit podíl zelené barvy na značce.,Change green level of marker for party member,Изменить уровень зелёного для меток группы,Zmień zielony poziom znacznika dla członka grupy,Change green level of marker for party member,Cambia il livello di Verde nei marcatori dei giocatori nel gruppo.,Cambiar marcador verde para miembro del grupo,Change green level of marker for party member,更改黨員的綠色標記,Alterar o nível verde de marcador para membro do grupo.,Change green level of marker for party member,更改党员的绿色标记
STR_EXPANSION_SETTINGS_HUD_BLUE_HEAD_PLAYER,BLUE MARKER PARTY MEMBER,BLUE MARKER PARTY MEMBER,MODRÁ ČÁST PARTY ZNAČKY,BLUE MARKER PARTY MEMBER,УРОВЕНЬ СИНЕГО ДЛЯ МЕТОК ГРУППЫ,NIEBIESKOŚĆ ZNACZNIKA CZŁONKA GRUPY,BLUE MARKER PARTY MEMBER,BLU MARCATORI DEI GIOCATORI,Marcador azul para miembro del grupo,BLUE MARKER PARTY MEMBER,藍色馬克黨成員,MARCAÇÃO AZUL DO MEMBRO DO GRUPO,BLUE MARKER PARTY MEMBER,蓝色马克党成员
STR_EXPANSION_SETTINGS_HUD_BLUE_HEAD_PLAYER_DESC,Change blue level of marker for party member,Change blue level of marker for party member,Změnit podíl modré barvy na značce.,Change blue level of marker for party member,Изменить уровень синего для меток группы,Zmień niebieski poziom znacznika dla członka grupy,Change blue level of marker for party member,Cambia il livello di Blu nei marcatori dei giocatori nel gruppo.,Cambiar marcador azul para miembro del grupo,Change blue level of marker for party member,更改派對成員的標記的藍色水平,Alterar o nível azul de marcador para membro do grupo,Change blue level of marker for party member,更改派对成员的标记的蓝色水平
STR_EXPANSION_SETTINGS_HUD_3D_MARKER_POINTING,ALPHA 3D MARKER POINTING AT,ALPHA 3D MARKER POINTING AT,PRŮHLEDNOST 3D ZNAČKY,ALPHA 3D MARKER POINTING AT,ПРОЗРАЧНОСТЬ 3Д МЕТКИ ПРИ ВЗГЛЯДЕ,PRZEZROCZYSTOŚĆ ZNACZNIKA 3D W WIDOKU,ALPHA 3D MARKER POINTING AT,ALPHA MARCATORE OSSERVATO,Marcador 3D alpha apuntando a,ALPHA 3D MARKER POINTING AT,阿爾法3D標記點,DIREÇÃO DA MARCAÇÃO ALFA ,ALPHA 3D MARKER POINTING AT,阿尔法3D标记点
STR_EXPANSION_SETTINGS_HUD_3D_MARKER_POINTING_DESC,Change alpha level of 3d marker when pointing at him,Change alpha level of 3d marker when pointing at him,"Změnit průhlednost 3d značky, když na ni míříte.",Change alpha level of 3d marker when pointing at him,Изменить прозрачность 3Д метки при взгляде на неё,Zmień przezroczystość znacznika 3D gdy na niego patrzysz. ,Change alpha level of 3d marker when pointing at him,Cambia il livello dell' Alpha (Trasparenza) di un marcatore 3D quando osservato,Cambiar marcador alpha 3D cuando apuntes a el,Change alpha level of 3d marker when pointing at him,指向他時更改3d標記的alpha等級,Alterar o nível alfa do marcador 3d ao apontar para ele.,Change alpha level of 3d marker when pointing at him,指向他时更改3d标记的alpha等级
STR_EXPANSION_SETTINGS_HUD_CHAT_SIZE,CHAT LINES FONT SIZE,CHAT LINES FONT SIZE,CHAT LINES FONT SIZE,CHAT LINES FONT SIZE,РАЗМЕР ШРИФТА,CHAT LINES FONT SIZE,CHAT LINES FONT SIZE,DIMENSIONE TESTO CHAT,TAMAÑO DE FUENTE DE LÍNEAS DE CHAT,TAILLE DU TCHAT,聊天線字體大小,CHAT LINES FONT SIZE,CHAT LINES FONT SIZE,聊天线字体大小
STR_EXPANSION_SETTINGS_HUD_CHAT_SIZE_DESC,Change font size of the chat lines.,Change font size of the chat lines.,Change font size of the chat lines.,Change font size of the chat lines.,Изменить размер шрифта линий чата.,Change font size of the chat lines.,Change font size of the chat lines.,Cambia la dimensione del font in chat di testo,Cambia el tamaño de fuente de las líneas de chat.,Changer la taille de police d'écriture dans le tchat,更改聊天行的字體大小。,Change font size of the chat lines.,Change font size of the chat lines.,更改聊天行的字体大小。
STR_EXPANSION_SETTINGS_HUD_CHAT_FADEOUT,CHAT FADEOUT TIME,CHAT FADEOUT TIME,CHAT FADEOUT TIME,CHAT FADEOUT TIME,ЧАТ ВРЕМЯ ИСЧЕЗНОВЕНИЯ,CHAT FADEOUT TIME,CHAT FADEOUT TIME,TEMPO DISSOLVENZA CHAT,TIEMPO PARA OCULTAR VENTANA DE CHAT,TEMPS DE DISPARITION DU TCHAT,聊天淡出時間,CHAT FADEOUT TIME,CHAT FADEOUT TIME,聊天淡出时间
STR_EXPANSION_SETTINGS_HUD_CHAT_FADEOUT_DESC,Chat window fadeout time duration.,Chat window fadeout time duration.,Chat window fadeout time duration.,Chat window fadeout time duration.,Время затухания окна чата.,Chat window fadeout time duration.,Chat window fadeout time duration.,Imposta il tempo di dissolvenza della chat testuale,Cambia el tiempo para ocultar la ventana de chat.,Durée du fondu de la fenêtre de discussion.,聊天窗口淡出時間長度。,Chat window fadeout time duration.,Chat window fadeout time duration.,聊天窗口淡出时间长度。
STR_EXPANSION_SETTINGS_MARKER_SIZE,MARKER ICON SIZE,MARKER ICON SIZE,MARKER ICON SIZE,MARKER ICON SIZE,РАЗМЕР ЗНАЧКА МЕТКИ,MARKER ICON SIZE,MARKER ICON SIZE,DIMENSIONE ICONE MARCATORI,TAMAÑO DEL ICONO DE MARCADOR,TAILLE DE L'ICÔNE DU MARQUEUR,標記圖標大小,MARKER ICON SIZE,MARKER ICON SIZE,标记图标大小
STR_EXPANSION_SETTINGS_MARKER_SIZE_DESC,Change the map and world marker icon size.,Change the map and world marker icon size.,Change the map and world marker icon size.,Change the map and world marker icon size.,Измените размер значка карты и метки.,Change the map and world marker icon size.,Change the map and world marker icon size.,Cambia le icone di mappa e marcatori,Cambia el tamaño de marcadores en el mapa y HUD.,Modifiez la taille de l'icône du marqueur de carte et du monde.,更改地圖和世界標記圖標的大小。,Change the map and world marker icon size.,Change the map and world marker icon size.,更改地图和世界标记图标的大小。
STR_EXPANSION_SETTINGS_PARTY_MEMBER_MARKER_NAME,NAMES ON PARTY MARKERS,NAMES ON PARTY MARKERS,NAMES ON PARTY MARKERS,NAMES ON PARTY MARKERS,ИМЕНА В ГРУППОВЫХ МЕТКАХ,NAMES ON PARTY MARKERS,NAMES ON PARTY MARKERS,NOMI SUI MARCATORI DI GRUPPO,NOMBRES EN MARCADORES DE GRUPO,NOMS SUR LES MARQUEURS DE GROUPE,派對標記上的名稱,NAMES ON PARTY MARKERS,NAMES ON PARTY MARKERS,派对标记上的名称
STR_EXPANSION_SETTINGS_PARTY_MEMBER_MARKER_NAME_DESC,Toggle the display of party members names on their head icon.,Toggle the display of party members names on their head icon.,Toggle the display of party members names on there head icon.,Toggle the display of party members names on there head icon.,Переключите отображение имен членов группы на значке головы.,Toggle the display of party members names on there head icon.,Toggle the display of party members names on there head icon.,Attiva o disattiva la visualizzazione di nomi dei membri del gruppo sulla loro icona,Alterna la visualización de los nombres de los miembros del grupo en su icono.,Basculez l'affichage des noms des membres du groupe sur leur icône de tête.,在該標題圖標上切換聚會成員姓名的顯示。,Toggle the display of party members names on there head icon.,Toggle the display of party members names on there head icon.,在该标题图标上切换聚会成员姓名的显示。
STR_EXPANSION_SETTINGS_PARTY_MEMBER_MARKER_DISTANCE,DISTANCE ON PARTY MARKERS,DISTANCE ON PARTY MARKERS,DISTANCE ON PARTY MARKERS,DISTANCE ON PARTY MARKERS,РАССТОЯНИЕ ПО МЕТКАМ,DISTANCE ON PARTY MARKERS,DISTANCE ON PARTY MARKERS,DISTANZA MARCATORI GRUPPO,DISTANCIA EN MARCADORES DE GRUPO,DISTANCE SUR LES MARQUEURS DE GROUPE,派對標誌的距離,DISTANCE ON PARTY MARKERS,DISTANCE ON PARTY MARKERS,派对标志的距离
STR_EXPANSION_SETTINGS_PARTY_MEMBER_MARKER_DISTANCE_DESC,Toggle the display of party members distance from your character on there head icon.,Toggle the display of party members distance from your character on there head icon.,Toggle the display of party members distance from your character on there head icon.,Toggle the display of party members distance from your character on there head icon.,Переключите отображение расстояния членов группы от вашего персонажа на значке головы.,Toggle the display of party members distance from your character on there head icon.,Toggle the display of party members distance from your character on there head icon.,Permette la visualizzazione della tua distanza dai membri del gruppo,Alterna la visualización de la distancia de los miembros del grupo a tu personaje en su ícono.,Basculez l'affichage de la distance des membres du groupe par rapport à votre personnage sur l'icône de la tête.,在頭部圖標上切換聚會成員與您角色的距離顯示。,Toggle the display of party members distance from your character on there head icon.,Toggle the display of party members distance from your character on there head icon.,在头部图标上切换聚会成员与您角色的距离显示。
STR_EXPANSION_SETTINGS_PARTY_QUICK_MARKER_NAME,NAMES ON QUICK MARKERS,NAMES ON QUICK MARKERS,NAMES ON QUICK MARKERS,NAMES ON QUICK MARKERS,ИМЕНА В БЫСТРЫХ МЕТКАХ,NAMES ON QUICK MARKERS,NAMES ON QUICK MARKERS,NOMI SU MARCATORI RAPIDI,NOMBRES EN MARCADORES RAPIDOS,NOMS SUR LES MARQUEURS RAPIDES,快速標記上的名稱,NAMES ON QUICK MARKERS,NAMES ON QUICK MARKERS,快速标记上的名称
STR_EXPANSION_SETTINGS_PARTY_QUICK_MARKER_NAME_DESC,Toggle the display of party members names on their quick marker.,Toggle the display of party members names on their quick marker.,Toggle the display of party members names on there quick marker.,Toggle the display of party members names on there quick marker.,Переключите отображение имен членов группы на быстрой метке.,Toggle the display of party members names on there quick marker.,Toggle the display of party members names on there quick marker.,Attiva o disattiva la visualizzazione dei nomi dei compagni sui loro marcatori,Alternar la visualización de los nombres de los miembros del grupo en su marcador rápido.,Bascule l'affichage des noms des membres du groupe sur leur marqueur rapide.,在該快速標記上切換聚會成員姓名的顯示。,Toggle the display of party members names on there quick marker.,Toggle the display of party members names on there quick marker.,在该快速标记上切换聚会成员姓名的显示。
STR_EXPANSION_SETTINGS_PARTY_QUICK_MARKER_DISTANCE,DISTANCE ON QUICK MARKERS,DISTANCE ON QUICK MARKERS,DISTANCE ON QUICK MARKERS,DISTANCE ON QUICK MARKERS,РАССТОЯНИЕ НА БЫСТРЫХ МЕТКАХ,DISTANCE ON QUICK MARKERS,DISTANCE ON QUICK MARKERS,DISTANZA SUI MARCATORI RAPIDI,DISTANCIA EN MARCADORES RAPIDOS,DISTANCE SUR LES MARQUEURS RAPIDES,快速標記的距離,DISTANCE ON QUICK MARKERS,DISTANCE ON QUICK MARKERS,快速标记的距离
STR_EXPANSION_SETTINGS_PARTY_QUICK_MARKER_DISTANCE_DESC,Toggle the display of party members distance from your character on their quick marker.,Toggle the display of party members distance from your character on their quick marker.,Toggle the display of party members distance from your character on there quick marker.,Toggle the display of party members distance from your character on there quick marker.,Переключите отображение расстояния членов группы от вашего персонажа на быстром метке.,Toggle the display of party members distance from your character on there quick marker.,Toggle the display of party members distance from your character on there quick marker.,Attiva o disattiva la visualizzazione della tua distanza dei membri del gruppo sui marcatori rapidi,Alterna la visualización de la distancia de los miembros del grupo a tu personaje en su marcador rápido.,Basculez l'affichage de la distance des membres du groupe par rapport à votre personnage sur leur marqueur rapide.,在快速標記上切換聚會成員與您角色的距離顯示。,Toggle the display of party members distance from your character on there quick marker.,Toggle the display of party members distance from your character on there quick marker.,在快速标记上切换聚会成员与您角色的距离显示。
STR_EXPANSION_SETTINGS_MAPMENULIST_STATE_PREFERENCE,SHOW MARKERLIST BY DEFAULT,SHOW MARKERLIST BY DEFAULT,SHOW MARKERLIST BY DEFAULT,SHOW MARKERLIST BY DEFAULT,ПОКАЗЫВАТЬ СПИСОК-МЕТОК ПО УМОЛЧАНИЮ,SHOW MARKERLIST BY DEFAULT,SHOW MARKERLIST BY DEFAULT,MOSTRA LISTA MARCATORI DI DEFAULT,MOSTRAR LISTA DE MARCADORES POR DEFECTO,AFFICHER LISTE DES MARQUEURS,按默認顯示標記列表,SHOW MARKERLIST BY DEFAULT,SHOW MARKERLIST BY DEFAULT,按默认显示标记列表
STR_EXPANSION_SETTINGS_MAPMENULIST_STATE_PREFERENCE_DESC,Expand the marker list when opening the map menu.,Expand the marker list when opening the map menu.,Expand the marker list when opening the map menu.,Expand the marker list when opening the map menu.,Раскройте список меток при открытии меню карты.,Expand the marker list when opening the map menu.,Expand the marker list when opening the map menu.,Espande la lista marcatori quando si apre il Menu Mappa,Expande la lista de marcadores al abrir el menu de mapa.,Développez la liste des marqueurs lors de l'ouverture du menu de la carte.,打開地圖菜單時，展開標記列表。,Expand the marker list when opening the map menu.,Expand the marker list when opening the map menu.,打开地图菜单时，展开标记列表。
STR_EXPANSION_SETTINGS_STREAMER_MODE,MISC SETTINGS,MISC SETTINGS,DALŠÍ NASTAVENÍ,SONSTIGE EINSTELLUNGEN,ПРОЧИЕ НАСТРОЙКИ,POZOSTAŁE USTAWIENIA,MISC SETTINGS,IMPOSTAZIONI VARIE,OTRAS CONFIGURACIONES,OPTIONS DIVERSES,雜項設定,OPÇÕES DIVERSAS,"配信モード
",杂项设定
STR_EXPANSION_SETTINGS_STREAMER_MODE_OPTION,STREAMER MODE,STREAMER MODE,STREAMER MÓD,STREAMER MODUS,РЕЖИМ ТРАНСЛЯЦИИ,TRYB STREAMERA,STREAMER MODE,MODALITA' STREAMER,MODO STREAMER,MODE STREAMEUR,隱私模式,MODO STREAMER,配信モード設定,隐私模式
STR_EXPANSION_SETTINGS_STREAMER_MODE_OPTION_DESC,Enables the streamer mode that will allow you to hide several inputs that you dont want to be shown to the public.,Enables the streamer mode that will allow you to hide several inputs that you dont want to be shown to the public.,"Streamer mód schová jisté prvky v UI, které by mohly prozradit server.","Ermöglicht es dir den Streamermodus einzuschalten, um gewisse Information der Öffentlichkeit nicht anzuzeigen.","Активирует режим трансляции, что позволяет скрыть определённые вещи, которые вы не хотите показывать всем.","Włącza tryb streamera, który pozwoli ci na ukrycie kilku elementów, których nie chcesz pokazywać publiczności.",Enables the streamer mode that will allow you to hide several inputs that you dont want to be shown to the public.,"Abilita la modalità Streamer, che ti permette di nascondere diversi input vuoi non far vedere ad altri.",Habilita el modo streamer que te permite esconder entradas que no quieres que el publico vea.,Active le mode streameur qui te permettera de cacher des informations dont tu ne veux pas qu'elles soient montrées en public.,開啟隱私模式，可以向用戶隱藏一些你不希望顯示的輸入。,Ativa o modo de stream que permite ocultar várias entradas que você não deseja que sejam exibidas ao público.,配信中に視聴者に見られては困る暗証番号など、その他諸々を隠すための設定です,开启隐私模式，可以向用户隐藏一些你不希望显示的输入。
STR_EXPANSION_SETTINGS_STREAMER_MODE_SHOW_PIN_CODE,SHOW PINCODES,SHOW PINCODES,UKÁZAT PIN KÓDY,SHOW PINCODES,ПОКАЗАТЬ ПИНКОДЫ,POKAŻ KODY,SHOW PINCODES,MOSTRA PIN,Mostrar codigos PIN,AFFICHER LES CODES PIN,显示PIN码,MOSTRAR SENHAS,SHOW PINCODES,显示PIN码
STR_EXPANSION_SETTINGS_STREAMER_MODE_SHOW_PIN_CODE_DESC,Toggles the display of pincodes in game and replaces the real characters with star characters.,Toggles the display of pincodes in game and replaces the real characters with star characters.,Přepnout zobrazení pin kódů (vymění za *).,Toggles the display of pincodes in game and replaces the real characters with star characters.,Переключает отображение пин-кодов в игре и заменяет на звёзды.,Przełącza wyświetlanie kodów PIN w grze i zastępuje prawdziwe postacie gwiazdami.,Toggles the display of pincodes in game and replaces the real characters with star characters.,"Abilita / Disabilita la visualizzazione dei PIN ingame, all'occorrenza nascondendoli e mostrando asterischi anzichè ciò che digiti","Alterna la visualización de códigos PIN en el juego y reemplaza los personajes reales con personajes estrella.
",Bascule l'affichage des codes pin en jeu et remplace les vrai caractères par des étoiles.,在遊戲中切換pincodes的顯示，並用星形字符替換真實字符。,Alterna a exibição de códigos PIN no jogo e os substitui por estrelas.,Toggles the display of pincodes in game and replaces the real characters with star characters.,在游戏中切换pincodes的显示，并用星形字符替换真实字符。 
STR_EXPANSION_SETTINGS_BB_CANCRAFTVANILLABASEBUILDING,Vanilla Base-building,Vanilla Base-building,Vanilla Base-building,Vanilla Basenbau,Ванильное строительство,Vanilla Base-building,Vanilla Base-building,Base Building Vanilla,Construccion Vanilla,Basebuilding Vanilla,Vanilla 基本基地建設,Vanilla Base-building,Vanilla Base-building,Vanilla 基本基地建设
STR_EXPANSION_SETTINGS_BB_CANCRAFTVANILLABASEBUILDING_DESC,Allow crafting of vanilla base-building items.,Allow crafting of vanilla base-building items.,Allow crafting of vanilla base-building items.,Erlaubt das bauen von Vanilla Basenteilen.,Доступ к созданию ванильных базовых предметов.,Allow crafting of vanilla base-building items.,Allow crafting of vanilla base-building items.,Permette la costruzione con le meccaniche vanilla,Permite el crafteo de elementos de construccion Vanilla,Permet de fabriquer d'objets de Basebuilding Vanilla.,允許製作香草基礎建築物品。,Allow crafting of vanilla base-building items.,Allow crafting of vanilla base-building items.,允许制作香草基础建筑物品。
STR_EXPANSION_SETTINGS_BB_CANCRAFTEXPANSIONBASEBUILDING,Expansion Base-building,Expansion Base-building,Expansion Base-building,Expansion Basenbau,Expansion строительство,Expansion Base-building,Expansion Base-building,Base Building di Expansion,Construccion Expansion,Basebuilding de Expansion,Expansion 基本基地建設,Expansion Base-building,Expansion Base-building,Expansion 基本基地建设
STR_EXPANSION_SETTINGS_BB_CANCRAFTEXPANSIONBASEBUILDING_DESC,Allow crafting of expansion base-building items.,Allow crafting of expansion base-building items.,Allow crafting of expansion base-building items.,Erlaubt das bauen von Expansion Basenteilen.,Доступ к созданию Expansion базовых предметов.,Allow crafting of expansion base-building items.,Allow crafting of expansion base-building items.,Permette la costruzione con le meccaniche avanzate di Expansion Mod,Permite el crafteo de elementos de construccion de Expansion,Permet de fabriquer d'objets de Basebuilding de Expansion.,允許擴展基礎建設項目的編制。,Allow crafting of expansion base-building items.,Allow crafting of expansion base-building items.,允许扩展基础建设项目的编制。
STR_EXPANSION_SETTINGS_BB_CANRAIDSAFES,Raiding Safes,Raiding Safes,Raiding Safes,Safes knacken,Рейд сейфов,Raiding Safes,Raiding Safes,Raid di Casseforti,Raid Cajas Fuertes,Destuction des coffres forts,突擊保險櫃,Raiding Safes,Raiding Safes,突击保险柜
STR_EXPANSION_SETTINGS_BB_CANRAIDSAFES_DESC,Allow raiding safes items.,Allow raiding safes items.,Allow raiding safes items.,Erlaubt es Safes aufzubrechen.,Разрешить рейд сейфов.,Allow raiding safes items.,Allow raiding safes items.,Permette di raidare le casseforti,Habilita el raid de Cajas Fuertes,Autoriser les objets de coffre-fort à être endomagé pour réveler leurs contenu.,允許突擊保險箱物品。,Allow raiding safes items.,Allow raiding safes items.,允许突击保险箱物品。
STR_EXPANSION_SETTINGS_BB_EXPLOSIONTIME,Time before explosion,Time before explosion,Time before explosion,Zeit vor der Explosion,Время до взрыва,Time before explosion,Time before explosion,Tempo prima dell'esplosione,Tiempo antes de la explosión,Temps avant l'explosion,爆炸前的時間,Time before explosion,Time before explosion,爆炸前的时间
STR_EXPANSION_SETTINGS_BB_EXPLOSIONTIME_DESC,Defined time before explosives go off.,Defined time before explosives go off.,Defined time before explosives go off.,Vorgegebene Zeit zur Explosion.,Определенное время до взрыва взрывчатки.,Defined time before explosives go off.,Defined time before explosives go off.,Definisce il tempo prima che una carica esploda,Define el tiempo antes de que estallen los explosivos.,Temps défini avant le déclenchement des explosifs.,炸藥放出之前規定的時間。,Defined time before explosives go off.,Defined time before explosives go off.,炸药放出之前规定的时间。
