LANGUAGE,ORIGINAL,ENGLISH,CZECH,GERMAN,RUSSIAN,POLISH,HUNGARIAN,ITALIAN,SPANISH,FRENCH,CHINESE,PORTUGUESE,JAPANESE,CHINESESIMP,
STR_EXPANSION_GARAGE_INFO_TERRITORY,- You must be member or owner of a territory to access the Virtual Garage.,- You must be member or owner of a territory to access the Virtual Garage.,- You must be member or owner of a territory to access the Virtual Garage.,- You must be member or owner of a territory to access the Virtual Garage.,"- Вы должны быть членом или владельцем территории, чтобы получить доступ к Виртуальному гаражу.",- You must be member or owner of a territory to access the Virtual Garage.,- You must be member or owner of a territory to access the Virtual Garage.,- Devi essere membro di un territorio per accedere al Garage Virtuale,- You must be member or owner of a territory to access the Virtual Garage.,- Vous devez être membre ou propriétaire d'un territoire pour accéder au Garage Virtuel.,- You must be member or owner of a territory to access the Virtual Garage.,- You must be member or owner of a territory to access the Virtual Garage.,- You must be member or owner of a territory to access the Virtual Garage.,- You must be member or owner of a territory to access the Virtual Garage.,
STR_EXPANSION_GARAGE_INFO_STORE,"- Store vehicles to protect them over restarts, from thieves and DayZ bugs.","- Store vehicles to protect them over restarts, from thieves and DayZ bugs.","- Store vehicles to protect them over restarts, from thieves and DayZ bugs.","- Store vehicles to protect them over restarts, from thieves and DayZ bugs.","- Храните автомобили, чтобы защитить их после перезапуска, от воров и багов DayZ.","- Store vehicles to protect them over restarts, from thieves and DayZ bugs.","- Store vehicles to protect them over restarts, from thieves and DayZ bugs.","- Immagazzina veicoli per proteggerli durante i restart, dai ladri e dai bug di DayZ","- Store vehicles to protect them over restarts, from thieves and DayZ bugs.","- Stockez les véhicules pour les protéger des redémarrages, des voleurs et des bugs DayZ.","- Store vehicles to protect them over restarts, from thieves and DayZ bugs.","- Store vehicles to protect them over restarts, from thieves and DayZ bugs.","- Store vehicles to protect them over restarts, from thieves and DayZ bugs.","- Store vehicles to protect them over restarts, from thieves and DayZ bugs.",
STR_EXPANSION_GARAGE_INFO_CARGO,- Vehicles with items in there cargo can not be stored.,- Vehicles with items in there cargo can not be stored.,- Vehicles with items in there cargo can not be stored.,- Vehicles with items in there cargo can not be stored.,- Транспортные средства с предметами в грузе не могут быть складированы.,- Vehicles with items in there cargo can not be stored.,- Vehicles with items in there cargo can not be stored.,- I veicoli con oggetti in inventario non possono essere immagazzinati!,- Vehicles with items in there cargo can not be stored.,- Les véhicules avec des objets dans leur cargaison ne peuvent pas être stockés.,- Vehicles with items in there cargo can not be stored.,- Vehicles with items in there cargo can not be stored.,- Vehicles with items in there cargo can not be stored.,- Vehicles with items in there cargo can not be stored.,
STR_EXPANSION_GARAGE_INFO_KEY,- Vehicles need a paired key bound to them to be stored.,- Vehicles need a paired key bound to them to be stored.,- Vehicles need a paired key bound to them to be stored.,- Vehicles need a paired key bound to them to be stored.,- Для хранения транспортных средств необходим привязанный к ним парный ключ.,- Vehicles need a paired key bound to them to be stored.,- Vehicles need a paired key bound to them to be stored.,- Il veicolo richiede una chiave accoppiata per poter essere immagazzinato,- Vehicles need a paired key bound to them to be stored.,- Les véhicules ont besoin d'une clé jumelée qui leur est liée pour être stockés.,- Vehicles need a paired key bound to them to be stored.,- Vehicles need a paired key bound to them to be stored.,- Vehicles need a paired key bound to them to be stored.,- Vehicles need a paired key bound to them to be stored.,
STR_EXPANSION_GARAGE_INFO_RETRIEVE,- Vehicles retrieve in the exact same position they are stored.,- Vehicles retrieve in the exact same position they are stored.,- Vehicles retrieve in the exact same position they are stored.,- Vehicles retrieve in the exact same position they are stored.,"- Транспортные средства возвращаются в том же положении, в котором они хранятся.",- Vehicles retrieve in the exact same position they are stored.,- Vehicles retrieve in the exact same position they are stored.,- I veicoli vengono ripristinati nella stessa posizione in cui sono stati immagazzinati,- Vehicles retrieve in the exact same position they are stored.,- Les véhicules récupèrent exactement la même position qu'ils sont stockés.,- Vehicles retrieve in the exact same position they are stored.,- Vehicles retrieve in the exact same position they are stored.,- Vehicles retrieve in the exact same position they are stored.,- Vehicles retrieve in the exact same position they are stored.,
STR_EXPANSION_GARAGE_INFO_WARRANTY,- Vehicles lost after Virtual Garage retrieval will not be compensated.,- Vehicles destroyed by the Virtual Garage retrieval will not be compensated.,- Vehicles destroyed by the Virtual Garage retrieval will not be compensated.,- Vehicles destroyed by the Virtual Garage retrieval will not be compensated.,"- Транспортные средства, уничтоженные в результате извлечения из виртуального гаража, не будут компенсированы.",- Vehicles destroyed by the Virtual Garage retrieval will not be compensated.,- Vehicles destroyed by the Virtual Garage retrieval will not be compensated.,- I veicoli persi dopo averli ripristinati dal Garage Virtuale non verranno compensati in caso di perdita,- Vehicles destroyed by the Virtual Garage retrieval will not be compensated.,- Les véhicules perdus après la récupération du garage virtuel ne seront pas indemnisés.,- Vehicles destroyed by the Virtual Garage retrieval will not be compensated.,- Vehicles destroyed by the Virtual Garage retrieval will not be compensated.,- Vehicles destroyed by the Virtual Garage retrieval will not be compensated.,- Vehicles destroyed by the Virtual Garage retrieval will not be compensated.,
STR_EXPANSION_GARAGE_INFO_RAIDING,- Vehicles can be retrieved by other players if they gain access to a garage access point within a territory.,- Vehicles can be retrieved by other players if they gain access to a garage access point within a territory.,- Vehicles can be retrieved by other players if they gain access to a garage access point within a territory.,- Vehicles can be retrieved by other players if they gain access to a garage access point within a territory.,"- Транспортные средства могут быть получены другими игроками, если они получат доступ к точке доступа к гаражу на территории.",- Vehicles can be retrieved by other players if they gain access to a garage access point within a territory.,- Vehicles can be retrieved by other players if they gain access to a garage access point within a territory.,- I veicoli possono essere recuperati da altri giocatori  se ottengono l'accesso ad un punto di accesso Garage nel territorio in cui vengono immagazzinati,- Vehicles can be retrieved by other players if they gain access to a garage access point within a territory.,- Les véhicules peuvent être récupérés par d'autres joueurs s'ils accèdent à un point d'accès de garage dans un territoire.,- Vehicles can be retrieved by other players if they gain access to a garage access point within a territory.,- Vehicles can be retrieved by other players if they gain access to a garage access point within a territory.,- Vehicles can be retrieved by other players if they gain access to a garage access point within a territory.,- Vehicles can be retrieved by other players if they gain access to a garage access point within a territory.,
STR_EXPANSION_GARAGE_INFO_PRICE,- Storing a vehicle will cost you the displayed amount on the vehicle entry.,- Storing a vehicle will cost you the displayed amount on the vehicle entry.,- Storing a vehicle will cost you the displayed amount on the vehicle entry.,- Storing a vehicle will cost you the displayed amount on the vehicle entry.,"- Хранение автомобиля обойдется вам в сумму, указанную в записи о транспортном средстве.",- Storing a vehicle will cost you the displayed amount on the vehicle entry.,- Storing a vehicle will cost you the displayed amount on the vehicle entry.,"- Immagazzinare un veicolo ti costerà quanto mostrato nella voce ""veicolo""",- Storing a vehicle will cost you the displayed amount on the vehicle entry.,- Le stockage d'un véhicule vous coûtera le montant affiché sur la fiche du véhicule.,- Storing a vehicle will cost you the displayed amount on the vehicle entry.,- Storing a vehicle will cost you the displayed amount on the vehicle entry.,- Storing a vehicle will cost you the displayed amount on the vehicle entry.,- Storing a vehicle will cost you the displayed amount on the vehicle entry.,
STR_EXPANSION_GARAGE_INFO_GROUP_STORE,- All your group members can store your vehicles when near a garage access point.,- All your group members can store your vehicles when near a garage access point.,- All your group members can store your vehicles when near a garage access point.,- All your group members can store your vehicles when near a garage access point.,"- Все члены вашей группы могут хранить ваши автомобили, находясь рядом с точкой доступа к гаражу.",- All your group members can store your vehicles when near a garage access point.,- All your group members can store your vehicles when near a garage access point.,- Tutti i membri del gruppo possono immagazzinare i tuoi veicoli vicino ad un punto di accesso garage.,- All your group members can store your vehicles when near a garage access point.,- Tous les membres de votre groupe peuvent stocker vos véhicules à proximité d'un point d'accès au garage.,- All your group members can store your vehicles when near a garage access point.,- All your group members can store your vehicles when near a garage access point.,- All your group members can store your vehicles when near a garage access point.,- All your group members can store your vehicles when near a garage access point.,
STR_EXPANSION_GARAGE_INFO_GROUP_RETRIEVE,- All your group members can retrieve your vehicles when near a garage access point.,- All your group members can retrieve your vehicles when near a garage access point.,- All your group members can retrieve your vehicles when near a garage access point.,- All your group members can retrieve your vehicles when near a garage access point.,"- Все члены вашей группы могут получить ваши автомобили, находясь рядом с точкой доступа в гараж.",- All your group members can retrieve your vehicles when near a garage access point.,- All your group members can retrieve your vehicles when near a garage access point.,- Tutti i membri del gruppo possono recuperare i tuoi veicoli vicino ad un punto di accesso garage.,- All your group members can retrieve your vehicles when near a garage access point.,- Tous les membres de votre groupe peuvent récupérer vos véhicules à proximité d'un point d'accès au garage.,- All your group members can retrieve your vehicles when near a garage access point.,- All your group members can retrieve your vehicles when near a garage access point.,- All your group members can retrieve your vehicles when near a garage access point.,- All your group members can retrieve your vehicles when near a garage access point.,
STR_EXPANSION_GARAGE_INFO_GROUP_STOREANDRETRIEVE,- All your group members can store and retrieve your vehicles when near a garage access point.,- All your group members can store and retrieve your vehicles when near a garage access point.,- All your group members can store and retrieve your vehicles when near a garage access point.,- All your group members can store and retrieve your vehicles when near a garage access point.,"- Все члены вашей группы могут хранить и извлекать ваши автомобили, находясь рядом с точкой доступа в гараж.",- All your group members can store and retrieve your vehicles when near a garage access point.,- All your group members can store and retrieve your vehicles when near a garage access point.,- Tutti i membri del gruppo possono immagazzinare e recuperare i tuoi veicoli vicino ad un punto di accesso garage.,- All your group members can store and retrieve your vehicles when near a garage access point.,- Tous les membres de votre groupe peuvent stocker et récupérer vos véhicules à proximité d'un point d'accès au garage.,- All your group members can store and retrieve your vehicles when near a garage access point.,- All your group members can store and retrieve your vehicles when near a garage access point.,- All your group members can store and retrieve your vehicles when near a garage access point.,- All your group members can store and retrieve your vehicles when near a garage access point.,
STR_EXPANSION_GARAGE_ERROR,GARAGE ERROR,GARAGE ERROR,GARAGE ERROR,GARAGE ERROR,ОШИБКА ГАРАЖА,GARAGE ERROR,GARAGE ERROR,ERRORE GARAGE,GARAGE ERROR,ERREUR GARAGE,GARAGE ERROR,GARAGE ERROR,GARAGE ERROR,GARAGE ERROR,
STR_EXPANSION_GARAGE_INFO,GARAGE INFO,GARAGE INFO,GARAGE INFO,GARAGE INFO,ИНФОРМАЦИЯ О ГАРАЖЕ,GARAGE INFO,GARAGE INFO,INFO GARAGE,GARAGE INFO,INFORMATIONS GARAGE,GARAGE INFO,GARAGE INFO,GARAGE INFO,GARAGE INFO,
STR_EXPANSION_GARAGE_ERROR_FREESPACE,Can't store vehicle %1 because the spot is already taken by another stored vehicle (%2).,Can't store vehicle %1 because the spot is already taken by another stored vehicle (%2).,Can't store vehicle %1 because the spot is already taken by another stored vehicle (%2).,Can't store vehicle %1 because the spot is already taken by another stored vehicle (%2).,"Невозможно сохранить автомобиль %1, потому что это место уже занято другим сохраненным автомобилем (%2).",Can't store vehicle %1 because the spot is already taken by another stored vehicle (%2).,Can't store vehicle %1 because the spot is already taken by another stored vehicle (%2).,Impossibile immagazzinare il veicolo %1 perchè lo spot è già preso da un altro veicolo immagazzinato (%2),Can't store vehicle %1 because the spot is already taken by another stored vehicle (%2).,Impossible de stocker le véhicule %1 car la place est déjà occupée par un autre véhicule stocké (%2).,Can't store vehicle %1 because the spot is already taken by another stored vehicle (%2).,Can't store vehicle %1 because the spot is already taken by another stored vehicle (%2).,Can't store vehicle %1 because the spot is already taken by another stored vehicle (%2).,Can't store vehicle %1 because the spot is already taken by another stored vehicle (%2).,
STR_EXPANSION_GARAGE_ERROR_CREW,Can't store vehicle %1. There is a player in the vehicle!,There is a player in the vehicle!,There is a player in the vehicle!,There is a player in the vehicle!,Не удается сохранить транспортное средство %1. В транспортном средстве находится игрок!,There is a player in the vehicle!,There is a player in the vehicle!,Impossibile immagazzinare il veicolo %1. C'è un giocatore nel veicolo!,There is a player in the vehicle!,Impossible de stocker le véhicule %1. Il y a un joueur dans le véhicule !,There is a player in the vehicle!,There is a player in the vehicle!,There is a player in the vehicle!,There is a player in the vehicle!,
STR_EXPANSION_GARAGE_ERROR_KEY,Can't store vehicle %1. Can only store vehicles with a paired key!,Can only store vehicles with a paired key!,Can only store vehicles with a paired key!,Can only store vehicles with a paired key!,Невозможно сохранить автомобиль %1. Можно сохранять только автомобили с сопряженным ключом!,Can only store vehicles with a paired key!,Can only store vehicles with a paired key!,Impossibile immagazzinare il veicolo %1. Si possono immagazzinare solo veicoli con chiave accoppiata!,Can only store vehicles with a paired key!,Impossible de stocker le véhicule %1. Ne peut stocker que des véhicules avec une clé jumelée !,Can only store vehicles with a paired key!,Can only store vehicles with a paired key!,Can only store vehicles with a paired key!,Can only store vehicles with a paired key!,
STR_EXPANSION_GARAGE_ERROR_CARGO,Can't store vehicle %1. Storing vehicles with cargo items is not allowed!,Storing vehicles with cargo items is not allowed!,Storing vehicles with cargo items is not allowed!,Storing vehicles with cargo items is not allowed!,Невозможно сохранить транспортное средство %1. Хранение автомобилей с грузом запрещено!,Storing vehicles with cargo items is not allowed!,Storing vehicles with cargo items is not allowed!,Impossibile immagazzinare il veicolo %1. Non si possono salvare veicoli con cargo in inventario!,Storing vehicles with cargo items is not allowed!,Impossible de stocker le véhicule %1. Le stockage de véhicules avec des articles de fret n'est pas autorisé !,Storing vehicles with cargo items is not allowed!,Storing vehicles with cargo items is not allowed!,Storing vehicles with cargo items is not allowed!,Storing vehicles with cargo items is not allowed!,
STR_EXPANSION_GARAGE_ERROR_TERRITORY,Can't store vehicle %1. You are in foreign territory!,You are in foreign territory!,You are in foreign territory!,You are in foreign territory!,Не удается сохранить автомобиль %1. Вы находитесь на чужой территории!,You are in foreign territory!,You are in foreign territory!,Impossibile immagazzinare il veicolo %1. Sei in un territorio straniero!,You are in foreign territory!,Impossible de stocker le véhicule %1. Vous êtes en territoire étranger !,You are in foreign territory!,You are in foreign territory!,You are in foreign territory!,You are in foreign territory!,
STR_EXPANSION_GARAGE_ERROR_STORELIMIT,Can't store vehicle %1. Max storable vehicle limit reached!,Max storable vehicle limit reached!,Max storable vehicle limit reached!,Max storable vehicle limit reached!,Не удается сохранить автомобиль %1. Достигнут максимальный лимит хранимых транспортных средств!,Max storable vehicle limit reached!,Max storable vehicle limit reached!,Impossibile immagazzinare il veicolo %1. Raggiunto massimo di veicoli!,Max storable vehicle limit reached!,Impossible de stocker le véhicule %1. Limite maximale de véhicules stockables atteinte !,Max storable vehicle limit reached!,Max storable vehicle limit reached!,Max storable vehicle limit reached!,Max storable vehicle limit reached!,
STR_EXPANSION_GARAGE_ERROR_PRICE,Can't store vehicle %1. Not enough money to store vehicle. Storing this vehicle costs %2. You have %3.,Can't store vehicle %1. Not enough money to store vehicle. Storing this vehicle costs %2. You have %3.,Can't store vehicle %1. Not enough money to store vehicle. Storing this vehicle costs %2. You have %3.,Can't store vehicle %1. Not enough money to store vehicle. Storing this vehicle costs %2. You have %3.,Не удается сохранить автомобиль %1. Не хватает денег для хранения автомобиля. Хранение этого автомобиля стоит %2. У вас есть %3.,Can't store vehicle %1. Not enough money to store vehicle. Storing this vehicle costs %2. You have %3.,Can't store vehicle %1. Not enough money to store vehicle. Storing this vehicle costs %2. You have %3.,"Impossibile immagazzinare il veicolo %1. Soldi non sufficienti. Immagazzinare costa %2, tu hai %3",Can't store vehicle %1. Not enough money to store vehicle. Storing this vehicle costs %2. You have %3.,Impossible de stocker le véhicule %1. Pas assez d'argent pour entreposer le véhicule. Le stockage de ce véhicule coûte %2. Vous avez %3.,Can't store vehicle %1. Not enough money to store vehicle. Storing this vehicle costs %2. You have %3.,Can't store vehicle %1. Not enough money to store vehicle. Storing this vehicle costs %2. You have %3.,Can't store vehicle %1. Not enough money to store vehicle. Storing this vehicle costs %2. You have %3.,Can't store vehicle %1. Not enough money to store vehicle. Storing this vehicle costs %2. You have %3.,
STR_EXPANSION_GARAGE_ERROR_BLOCKED,%1: Position is blocked by another object (%2 at %3).,%1: Position is blocked by another object (%2 at %3).,%1: Position is blocked by another object (%2 at %3).,%1: Position is blocked by another object (%2 at %3).,%1: Место спавна заблокировано другим объектом (%2 на %3).,%1: Position is blocked by another object (%2 at %3).,%1: Position is blocked by another object (%2 at %3).,%1: Bloccato da un altro oggetto (%2 a %3),%1: Position is blocked by another object (%2 at %3).,%1 : la position est bloquée par un autre objet (%2 à %3).,%1: Position is blocked by another object (%2 at %3).,%1: Position is blocked by another object (%2 at %3).,%1: Position is blocked by another object (%2 at %3).,%1: Position is blocked by another object (%2 at %3).,
STR_EXPANSION_GARAGE_ERROR_DESTROYED,Can't store vehicle %1. Vehicle is destroyed!,Can't store vehicle %1. Vehicle is destroyed!,Can't store vehicle %1. Vehicle is destroyed!,Can't store vehicle %1. Vehicle is destroyed!,Не удается сохранить автомобиль %1. Транспортное средство уничтожено!,Can't store vehicle %1. Vehicle is destroyed!,Can't store vehicle %1. Vehicle is destroyed!,Impossibile immagazzinare il veicolo %1. Veicolo distrutto!,Can't store vehicle %1. Vehicle is destroyed!,Impossible de stocker le véhicule %1. Le véhicule est détruit !,Can't store vehicle %1. Vehicle is destroyed!,Can't store vehicle %1. Vehicle is destroyed!,Can't store vehicle %1. Vehicle is destroyed!,Can't store vehicle %1. Vehicle is destroyed!,
STR_EXPANSION_GARAGE_ERROR_STORED,Can't store vehicle %1. Can't find vehicle object. Vehicle has already been stored?!,Can't store vehicle %1. Can't find vehicle object. Vehicle has already been stored?!,Can't store vehicle %1. Can't find vehicle object. Vehicle has already been stored?!,Can't store vehicle %1. Can't find vehicle object. Vehicle has already been stored?!,Не удается сохранить автомобиль %1. Не удается найти объект транспортного средства. Автомобиль уже был сохранен?!,Can't store vehicle %1. Can't find vehicle object. Vehicle has already been stored?!,Can't store vehicle %1. Can't find vehicle object. Vehicle has already been stored?!,Impossibile immagazzinare il veicolo %1. Impossibile trovarlo! Che sia stato già immagazzinato?,Can't store vehicle %1. Can't find vehicle object. Vehicle has already been stored?!,Impossible de stocker le véhicule %1. Impossible de trouver l'objet véhicule. Le véhicule a déjà été stocké ? !,Can't store vehicle %1. Can't find vehicle object. Vehicle has already been stored?!,Can't store vehicle %1. Can't find vehicle object. Vehicle has already been stored?!,Can't store vehicle %1. Can't find vehicle object. Vehicle has already been stored?!,Can't store vehicle %1. Can't find vehicle object. Vehicle has already been stored?!,
